measurement_id,component_id,lot_id_cmm,feature_name,nominal_value,upper_tolerance,lower_tolerance,measured_value,measurement_timestamp,cmm_machine_id,inspector_id,result,production_order_id,part_id,lot_id_erp,production_timestamp,quantity,machine_id,operator_id,shift,plant_code,status,pass_flag,z_score,anomaly_z,anomaly_iforest
M0000001,PART-041,LOT-00001,outer_diameter,100,100.5,99.5,100.083,1/7/2024 9:36,CMM2,QC005,pass,PO000001,PART-041,LOT-00001,2024-01-06 01:36:00,32,M009,OP032,3,PLANT1,completed,True,2.2039509811813547,False,False
M0000002,PART-007,LOT-00002,parallelism,0,0.1,0.0,-0.005,1/26/2024 13:41,CMM1,QC003,fail,PO000002,PART-007,LOT-00002,2024-01-25 19:41:00,64,M019,OP055,2,PLANT1,completed,False,-0.8798004521804349,False,False
M0000003,PART-014,LOT-00003,thickness,5,5.05,4.95,5.011,1/11/2024 19:07,CMM1,QC008,pass,PO000003,PART-014,LOT-00003,2024-01-11 14:07:00,278,M020,OP004,2,PLANT3,completed,True,-0.7252554798586507,False,False
M0000004,PART-042,LOT-00004,outer_diameter,100,100.5,99.5,100.254,1/27/2024 12:13,CMM2,QC012,pass,PO000004,PART-042,LOT-00004,2024-01-25 19:13:00,234,M008,OP058,2,PLANT3,completed,True,2.209219559783234,False,False
M0000005,PART-001,LOT-00005,width,10,10.1,9.9,9.992,1/8/2024 10:23,CMM2,QC008,pass,PO000005,PART-001,LOT-00005,2024-01-08 06:23:00,377,M014,OP044,1,PLANT2,completed,True,-0.5717888715781867,False,False
M0000006,PART-049,LOT-00006,bore_diameter,50,50.4,49.6,49.969,1/17/2024 2:39,CMM2,QC001,pass,PO000006,PART-049,LOT-00006,2024-01-16 07:39:00,72,M003,OP049,1,PLANT1,completed,True,0.6599185364178194,False,False
M0000007,PART-023,LOT-00007,parallelism,0,0.1,0.0,0.053,1/28/2024 16:25,CMM3,QC004,pass,PO000007,PART-023,LOT-00007,2024-01-28 11:25:00,155,M002,OP094,1,PLANT2,completed,True,-0.8780134489119613,False,False
M0000008,PART-025,LOT-00008,bore_diameter,50,50.4,49.6,50.102,1/6/2024 13:04,CMM2,QC012,pass,PO000008,PART-025,LOT-00008,2024-01-04 14:04:00,302,M010,OP081,2,PLANT3,in_progress,True,0.6640163197748362,False,False
M0000009,PART-024,LOT-00009,thickness,5,5.05,4.95,4.992,1/28/2024 2:37,CMM2,QC015,pass,PO000009,PART-024,LOT-00009,2024-01-27 06:37:00,118,M003,OP006,1,PLANT3,completed,True,-0.7258408774810816,False,False
M0000010,PART-019,LOT-00010,flatness,0,0.1,0.0,0.018,1/6/2024 12:09,CMM2,QC008,pass,PO000010,PART-019,LOT-00010,2024-01-04 15:09:00,457,M008,OP013,2,PLANT2,completed,True,-0.8790918129532815,False,False
M0000011,PART-041,LOT-00011,thickness,5,5.05,4.95,4.992,1/18/2024 9:29,CMM1,QC018,pass,PO000011,PART-041,LOT-00011,2024-01-17 14:29:00,103,M012,OP046,2,PLANT1,completed,True,-0.7258408774810816,False,False
M0000012,PART-045,LOT-00012,length,20,20.2,19.8,19.969,1/30/2024 17:49,CMM1,QC014,pass,PO000012,PART-045,LOT-00012,2024-01-30 11:49:00,56,M020,OP082,1,PLANT1,completed,True,-0.26439349899955017,False,False
M0000013,PART-016,LOT-00013,thickness,5,5.05,4.95,5.004,1/8/2024 13:28,CMM2,QC010,pass,PO000013,PART-016,LOT-00013,2024-01-08 10:28:00,256,M013,OP035,1,PLANT3,completed,True,-0.7254711526669148,False,False
M0000014,PART-015,LOT-00014,outer_diameter,100,100.5,99.5,99.681,1/17/2024 16:12,CMM1,QC001,pass,PO000014,PART-015,LOT-00014,2024-01-15 18:12:00,451,M002,OP030,2,PLANT1,in_progress,True,2.191565199906762,False,True
M0000015,PART-026,LOT-00015,flatness,0,0.1,0.0,-0.057,1/15/2024 0:26,CMM3,QC013,fail,PO000015,PART-026,LOT-00015,2024-01-13 04:26:00,53,M007,OP073,3,PLANT3,completed,False,-0.8814025930418249,False,False
M0000016,PART-042,LOT-00016,flatness,0,0.1,0.0,-0.019,1/23/2024 22:17,CMM1,QC002,fail,PO000016,PART-042,LOT-00016,2024-01-23 17:17:00,222,M015,OP019,2,PLANT2,completed,False,-0.8802317977969629,False,False
M0000017,PART-048,LOT-00017,length,20,20.2,19.8,19.932,1/27/2024 5:09,CMM1,QC004,pass,PO000017,PART-048,LOT-00017,2024-01-26 13:09:00,295,M009,OP096,1,PLANT3,completed,True,-0.26553348384323167,False,False
M0000018,PART-038,LOT-00018,flatness,0,0.1,0.0,0.01,1/20/2024 6:15,CMM3,QC005,pass,PO000018,PART-038,LOT-00018,2024-01-19 04:15:00,205,M008,OP018,3,PLANT3,completed,True,-0.8793382961627262,False,False
M0000019,PART-049,LOT-00019,length,20,20.2,19.8,19.939,1/4/2024 19:27,CMM2,QC012,pass,PO000019,PART-049,LOT-00019,2024-01-03 03:27:00,460,M004,OP020,3,PLANT3,completed,True,-0.2653178110349676,False,False
M0000020,PART-044,LOT-00020,flatness,0,0.1,0.0,-0.047,1/21/2024 5:06,CMM3,QC019,fail,PO000020,PART-044,LOT-00020,2024-01-20 05:06:00,325,M003,OP050,3,PLANT2,completed,False,-0.8810944890300192,False,False
M0000021,PART-030,LOT-00021,flatness,0,0.1,0.0,0.049,1/25/2024 2:56,CMM3,QC007,pass,PO000021,PART-030,LOT-00021,2024-01-25 01:56:00,148,M018,OP002,3,PLANT3,completed,True,-0.8781366905166836,False,False
M0000022,PART-044,LOT-00022,thickness,5,5.05,4.95,4.996,1/27/2024 7:30,CMM1,QC001,pass,PO000022,PART-044,LOT-00022,2024-01-25 10:30:00,404,M009,OP099,1,PLANT3,completed,True,-0.7257176358763593,False,False
M0000023,PART-019,LOT-00023,bore_diameter,50,50.4,49.6,50.009,1/21/2024 8:52,CMM1,QC012,pass,PO000023,PART-019,LOT-00023,2024-01-20 18:52:00,100,M015,OP001,2,PLANT3,in_progress,True,0.6611509524650425,False,False
M0000024,PART-017,LOT-00024,parallelism,0,0.1,0.0,-0.047,1/24/2024 2:46,CMM3,QC015,fail,PO000024,PART-017,LOT-00024,2024-01-23 18:46:00,410,M006,OP065,2,PLANT1,in_progress,False,-0.8810944890300192,False,False
M0000025,PART-020,LOT-00025,bore_diameter,50,50.4,49.6,49.927,1/30/2024 11:54,CMM1,QC001,pass,PO000025,PART-020,LOT-00025,2024-01-30 01:54:00,279,M020,OP026,3,PLANT1,completed,True,0.658624499568235,False,False
M0000026,PART-011,LOT-00026,bore_diameter,50,50.4,49.6,50.015,1/27/2024 7:08,CMM2,QC009,pass,PO000026,PART-011,LOT-00026,2024-01-25 13:08:00,418,M017,OP001,1,PLANT3,completed,True,0.661335814872126,False,False
M0000027,PART-002,LOT-00027,angle,45,46.0,44.0,44.616,1/8/2024 1:11,CMM1,QC009,pass,PO000027,PART-002,LOT-00027,2024-01-06 02:11:00,495,M012,OP040,3,PLANT1,completed,True,0.49499045889818005,False,False
M0000028,PART-037,LOT-00028,width,10,10.1,9.9,10.013,1/4/2024 21:01,CMM1,QC020,pass,PO000028,PART-037,LOT-00028,2024-01-04 14:01:00,63,M016,OP009,2,PLANT3,completed,True,-0.5711418531533946,False,False
M0000029,PART-009,LOT-00029,angle,45,46.0,44.0,44.8,1/23/2024 12:08,CMM1,QC002,pass,PO000029,PART-009,LOT-00029,2024-01-22 15:08:00,301,M006,OP034,2,PLANT3,in_progress,True,0.5006595727154065,False,False
M0000030,PART-028,LOT-00030,angle,45,46.0,44.0,44.903,1/11/2024 23:20,CMM3,QC001,pass,PO000030,PART-028,LOT-00030,2024-01-10 15:20:00,495,M018,OP097,2,PLANT3,completed,True,0.5038330440370061,False,False
M0000031,PART-046,LOT-00031,length,20,20.2,19.8,19.96,1/16/2024 13:28,CMM2,QC001,pass,PO000031,PART-046,LOT-00031,2024-01-15 04:28:00,224,M012,OP057,3,PLANT3,completed,True,-0.2646707926101754,False,False
M0000032,PART-016,LOT-00032,flatness,0,0.1,0.0,-0.017,1/11/2024 16:25,CMM2,QC001,fail,PO000032,PART-016,LOT-00032,2024-01-11 05:25:00,52,M011,OP003,3,PLANT3,completed,False,-0.8801701769946018,False,False
M0000033,PART-038,LOT-00033,flatness,0,0.1,0.0,0.062,1/11/2024 19:32,CMM2,QC009,pass,PO000033,PART-038,LOT-00033,2024-01-11 00:32:00,23,M003,OP091,3,PLANT3,completed,True,-0.8777361553013361,False,False
M0000034,PART-005,LOT-00034,parallelism,0,0.1,0.0,0.0,1/3/2024 11:18,CMM3,QC020,pass,PO000034,PART-005,LOT-00034,2024-01-02 10:18:00,460,M011,OP010,1,PLANT3,completed,True,-0.879646400174532,False,False
M0000035,PART-043,LOT-00035,angle,45,46.0,44.0,43.864,1/23/2024 7:12,CMM3,QC017,fail,PO000035,PART-043,LOT-00035,2024-01-23 02:12:00,129,M018,OP017,3,PLANT3,delayed,False,0.4718210372103846,False,True
M0000036,PART-037,LOT-00036,angle,45,46.0,44.0,44.647,1/29/2024 1:22,CMM2,QC007,pass,PO000036,PART-037,LOT-00036,2024-01-27 05:22:00,262,M008,OP061,3,PLANT2,completed,True,0.49594558133477795,False,False
M0000037,PART-007,LOT-00037,bore_diameter,50,50.4,49.6,50.11,1/31/2024 23:47,CMM2,QC012,pass,PO000037,PART-007,LOT-00037,2024-01-30 23:47:00,240,M012,OP055,3,PLANT2,completed,True,0.664262802984281,False,False
M0000038,PART-047,LOT-00038,flatness,0,0.1,0.0,-0.041,1/4/2024 1:10,CMM3,QC018,fail,PO000038,PART-047,LOT-00038,2024-01-03 11:10:00,364,M004,OP008,1,PLANT2,completed,False,-0.8809096266229357,False,False
M0000039,PART-007,LOT-00039,parallelism,0,0.1,0.0,0.007,1/13/2024 15:35,CMM2,QC013,pass,PO000039,PART-007,LOT-00039,2024-01-12 07:35:00,118,M007,OP069,1,PLANT2,completed,True,-0.8794307273662679,False,False
M0000040,PART-012,LOT-00040,angle,45,46.0,44.0,44.347,1/15/2024 7:14,CMM3,QC008,pass,PO000040,PART-012,LOT-00040,2024-01-13 16:14:00,256,M008,OP010,2,PLANT2,in_progress,True,0.4867024609806043,False,False
M0000041,PART-036,LOT-00041,outer_diameter,100,100.5,99.5,99.779,1/7/2024 4:56,CMM1,QC014,pass,PO000041,PART-036,LOT-00041,2024-01-05 10:56:00,45,M018,OP002,1,PLANT1,delayed,True,2.1945846192224585,False,False
M0000042,PART-016,LOT-00042,length,20,20.2,19.8,20.013,1/8/2024 21:39,CMM3,QC001,pass,PO000042,PART-016,LOT-00042,2024-01-08 13:39:00,228,M016,OP062,1,PLANT1,in_progress,True,-0.26303784134760466,False,False
M0000043,PART-004,LOT-00043,outer_diameter,100,100.5,99.5,100.123,1/10/2024 9:49,CMM1,QC018,pass,PO000043,PART-004,LOT-00043,2024-01-08 11:49:00,214,M001,OP050,1,PLANT2,delayed,True,2.205183397228578,False,False
M0000044,PART-030,LOT-00044,flatness,0,0.1,0.0,0.143,1/14/2024 16:34,CMM3,QC015,fail,PO000044,PART-030,LOT-00044,2024-01-13 23:34:00,236,M018,OP085,3,PLANT3,completed,False,-0.8752405128057091,False,True
M0000045,PART-013,LOT-00045,outer_diameter,100,100.5,99.5,100.029,1/16/2024 3:05,CMM1,QC007,pass,PO000045,PART-013,LOT-00045,2024-01-14 12:05:00,131,M002,OP075,1,PLANT3,completed,True,2.2022872195176033,False,False
M0000046,PART-048,LOT-00046,bore_diameter,50,50.4,49.6,49.985,1/15/2024 13:32,CMM3,QC009,pass,PO000046,PART-048,LOT-00046,2024-01-15 06:32:00,49,M002,OP075,1,PLANT2,completed,True,0.6604115028367086,False,False
M0000047,PART-034,LOT-00047,angle,45,46.0,44.0,44.9,1/9/2024 14:57,CMM1,QC019,pass,PO000047,PART-034,LOT-00047,2024-01-08 03:57:00,49,M017,OP011,3,PLANT1,completed,True,0.5037406128334645,False,False
M0000048,PART-005,LOT-00048,thickness,5,5.05,4.95,4.975,1/13/2024 5:54,CMM3,QC004,pass,PO000048,PART-005,LOT-00048,2024-01-11 16:54:00,226,M004,OP073,2,PLANT1,completed,True,-0.7263646543011515,False,False
M0000049,PART-003,LOT-00049,thickness,5,5.05,4.95,4.988,1/30/2024 16:31,CMM3,QC002,pass,PO000049,PART-003,LOT-00049,2024-01-29 04:31:00,61,M014,OP085,3,PLANT3,completed,True,-0.725964119085804,False,False
M0000050,PART-021,LOT-00050,angle,45,46.0,44.0,44.846,1/14/2024 0:49,CMM1,QC018,pass,PO000050,PART-021,LOT-00050,2024-01-12 20:49:00,124,M011,OP031,2,PLANT2,completed,True,0.5020768511697131,False,False
M0000051,PART-043,LOT-00051,width,10,10.1,9.9,10.035,1/30/2024 14:03,CMM3,QC014,pass,PO000051,PART-043,LOT-00051,2024-01-30 09:03:00,173,M015,OP041,1,PLANT1,completed,True,-0.5704640243274218,False,False
M0000052,PART-040,LOT-00052,parallelism,0,0.1,0.0,0.011,1/26/2024 17:56,CMM3,QC011,pass,PO000052,PART-040,LOT-00052,2024-01-26 14:56:00,71,M003,OP069,2,PLANT1,completed,True,-0.8793074857615456,False,False
M0000053,PART-009,LOT-00053,width,10,10.1,9.9,9.941,1/18/2024 19:12,CMM2,QC016,pass,PO000053,PART-009,LOT-00053,2024-01-16 21:12:00,471,M003,OP032,2,PLANT2,completed,True,-0.5733602020383962,False,False
M0000054,PART-029,LOT-00054,bore_diameter,50,50.4,49.6,50.043,1/26/2024 9:20,CMM3,QC017,pass,PO000054,PART-029,LOT-00054,2024-01-25 17:20:00,380,M010,OP079,2,PLANT3,completed,True,0.6621985061051822,False,False
M0000055,PART-043,LOT-00055,flatness,0,0.1,0.0,-0.013,1/27/2024 14:46,CMM3,QC014,fail,PO000055,PART-043,LOT-00055,2024-01-26 05:46:00,173,M004,OP018,3,PLANT2,completed,False,-0.8800469353898795,False,False
M0000056,PART-007,LOT-00056,angle,45,46.0,44.0,44.774,1/27/2024 22:16,CMM1,QC019,pass,PO000056,PART-007,LOT-00056,2024-01-26 04:16:00,99,M009,OP037,3,PLANT3,completed,True,0.49985850228471157,False,False
M0000057,PART-022,LOT-00057,length,20,20.2,19.8,20.041,1/12/2024 0:22,CMM3,QC018,pass,PO000057,PART-022,LOT-00057,2024-01-10 06:22:00,371,M009,OP065,1,PLANT2,completed,True,-0.2621751501145485,False,False
M0000058,PART-004,LOT-00058,length,20,20.2,19.8,20.069,1/5/2024 14:48,CMM3,QC006,pass,PO000058,PART-004,LOT-00058,2024-01-05 04:48:00,344,M014,OP036,3,PLANT1,completed,True,-0.26131245888149235,False,False
M0000059,PART-050,LOT-00059,bore_diameter,50,50.4,49.6,50.124,1/7/2024 5:53,CMM3,QC007,pass,PO000059,PART-050,LOT-00059,2024-01-06 22:53:00,346,M009,OP021,3,PLANT3,completed,True,0.6646941486008092,False,False
M0000060,PART-046,LOT-00060,length,20,20.2,19.8,19.944,1/21/2024 0:08,CMM1,QC014,pass,PO000060,PART-046,LOT-00060,2024-01-20 11:08:00,307,M001,OP015,1,PLANT1,delayed,True,-0.2651637590290647,False,False
M0000061,PART-045,LOT-00061,angle,45,46.0,44.0,44.897,1/9/2024 16:48,CMM2,QC014,pass,PO000061,PART-045,LOT-00061,2024-01-07 18:48:00,299,M002,OP048,2,PLANT3,completed,True,0.5036481816299228,False,False
M0000062,PART-028,LOT-00062,parallelism,0,0.1,0.0,0.011,1/8/2024 11:12,CMM2,QC017,pass,PO000062,PART-028,LOT-00062,2024-01-06 19:12:00,41,M010,OP047,2,PLANT1,in_progress,True,-0.8793074857615456,False,False
M0000063,PART-014,LOT-00063,bore_diameter,50,50.4,49.6,50.13,1/13/2024 9:33,CMM2,QC011,pass,PO000063,PART-014,LOT-00063,2024-01-12 08:33:00,361,M004,OP046,1,PLANT3,in_progress,True,0.6648790110078927,False,False
M0000064,PART-027,LOT-00064,width,10,10.1,9.9,9.984,1/29/2024 22:55,CMM3,QC009,pass,PO000064,PART-027,LOT-00064,2024-01-29 05:55:00,403,M005,OP031,3,PLANT1,delayed,True,-0.5720353547876313,False,False
M0000065,PART-012,LOT-00065,angle,45,46.0,44.0,44.938,1/21/2024 0:20,CMM2,QC005,pass,PO000065,PART-012,LOT-00065,2024-01-19 18:20:00,32,M006,OP095,2,PLANT2,completed,True,0.5049114080783266,False,False
M0000066,PART-027,LOT-00066,outer_diameter,100,100.5,99.5,99.816,1/13/2024 23:03,CMM1,QC003,pass,PO000066,PART-027,LOT-00066,2024-01-12 07:03:00,156,M006,OP090,1,PLANT1,completed,True,2.19572460406614,False,False
M0000067,PART-003,LOT-00067,parallelism,0,0.1,0.0,-0.04,1/23/2024 8:07,CMM3,QC011,fail,PO000067,PART-003,LOT-00067,2024-01-22 10:07:00,133,M007,OP059,1,PLANT2,completed,False,-0.8808788162217551,False,False
M0000068,PART-015,LOT-00068,length,20,20.2,19.8,20.054,1/12/2024 23:29,CMM3,QC016,pass,PO000068,PART-015,LOT-00068,2024-01-11 03:29:00,32,M007,OP052,3,PLANT2,completed,True,-0.26177461489920106,False,False
M0000069,PART-005,LOT-00069,thickness,5,5.05,4.95,5.023,1/14/2024 21:52,CMM2,QC003,pass,PO000069,PART-005,LOT-00069,2024-01-13 16:52:00,199,M017,OP052,2,PLANT3,delayed,True,-0.7248857550444837,False,False
M0000070,PART-035,LOT-00070,outer_diameter,100,100.5,99.5,99.988,1/16/2024 19:42,CMM3,QC013,pass,PO000070,PART-035,LOT-00070,2024-01-16 01:42:00,500,M001,OP015,3,PLANT2,completed,True,2.2010239930691995,False,False
M0000071,PART-017,LOT-00071,length,20,20.2,19.8,20.067,1/3/2024 13:47,CMM1,QC004,pass,PO000071,PART-017,LOT-00071,2024-01-02 17:47:00,75,M020,OP056,2,PLANT2,completed,True,-0.26137407968385346,False,False
M0000072,PART-021,LOT-00072,parallelism,0,0.1,0.0,0.012,1/21/2024 17:39,CMM1,QC009,pass,PO000072,PART-021,LOT-00072,2024-01-20 20:39:00,330,M017,OP015,2,PLANT2,in_progress,True,-0.879276675360365,False,False
M0000073,PART-013,LOT-00073,flatness,0,0.1,0.0,-0.022,1/13/2024 10:13,CMM1,QC012,fail,PO000073,PART-013,LOT-00073,2024-01-12 14:13:00,42,M014,OP001,2,PLANT3,delayed,False,-0.8803242290005047,False,False
M0000074,PART-035,LOT-00074,flatness,0,0.1,0.0,0.012,1/10/2024 6:12,CMM3,QC013,pass,PO000074,PART-035,LOT-00074,2024-01-09 23:12:00,206,M014,OP009,3,PLANT3,delayed,True,-0.879276675360365,False,False
M0000075,PART-040,LOT-00075,parallelism,0,0.1,0.0,0.051,1/16/2024 9:52,CMM1,QC001,pass,PO000075,PART-040,LOT-00075,2024-01-15 06:52:00,359,M004,OP093,1,PLANT2,completed,True,-0.8780750697143225,False,False
M0000076,PART-043,LOT-00076,bore_diameter,50,50.4,49.6,49.995,1/20/2024 3:04,CMM2,QC017,pass,PO000076,PART-043,LOT-00076,2024-01-19 14:04:00,187,M013,OP090,2,PLANT2,completed,True,0.6607196068485144,False,False
M0000077,PART-013,LOT-00077,length,20,20.2,19.8,20.104,1/20/2024 10:14,CMM2,QC007,pass,PO000077,PART-013,LOT-00077,2024-01-20 03:14:00,360,M013,OP087,3,PLANT3,delayed,True,-0.26023409484017207,False,False
M0000078,PART-040,LOT-00078,bore_diameter,50,50.4,49.6,49.651,1/28/2024 20:36,CMM2,QC019,pass,PO000078,PART-040,LOT-00078,2024-01-26 21:36:00,174,M013,OP071,2,PLANT1,completed,True,0.6501208288423953,False,False
M0000079,PART-014,LOT-00079,parallelism,0,0.1,0.0,0.027,1/20/2024 22:33,CMM1,QC009,pass,PO000079,PART-014,LOT-00079,2024-01-20 13:33:00,422,M019,OP078,1,PLANT3,completed,True,-0.8788145193426563,False,False
M0000080,PART-029,LOT-00080,length,20,20.2,19.8,20.006,1/21/2024 19:57,CMM3,QC007,pass,PO000080,PART-029,LOT-00080,2024-01-21 02:57:00,365,M007,OP066,3,PLANT2,completed,True,-0.2632535141558688,False,False
M0000081,PART-048,LOT-00081,thickness,5,5.05,4.95,4.995,1/10/2024 7:20,CMM1,QC016,pass,PO000081,PART-048,LOT-00081,2024-01-08 17:20:00,357,M003,OP037,2,PLANT3,completed,True,-0.7257484462775399,False,False
M0000082,PART-040,LOT-00082,flatness,0,0.1,0.0,0.003,1/16/2024 9:06,CMM3,QC017,pass,PO000082,PART-040,LOT-00082,2024-01-16 06:06:00,67,M008,OP087,1,PLANT2,completed,True,-0.8795539689709903,False,False
M0000083,PART-013,LOT-00083,thickness,5,5.05,4.95,4.967,1/9/2024 12:56,CMM1,QC003,pass,PO000083,PART-013,LOT-00083,2024-01-07 16:56:00,32,M002,OP032,2,PLANT2,completed,True,-0.7266111375105962,False,False
M0000084,PART-050,LOT-00084,bore_diameter,50,50.4,49.6,49.971,1/4/2024 20:32,CMM1,QC010,pass,PO000084,PART-050,LOT-00084,2024-01-04 07:32:00,253,M014,OP081,1,PLANT3,completed,True,0.6599801572201804,False,False
M0000085,PART-045,LOT-00085,bore_diameter,50,50.4,49.6,50.048,1/19/2024 8:24,CMM1,QC015,pass,PO000085,PART-045,LOT-00085,2024-01-18 11:24:00,273,M013,OP032,1,PLANT1,completed,True,0.6623525581110852,False,False
M0000086,PART-001,LOT-00086,width,10,10.1,9.9,10.049,1/7/2024 5:25,CMM2,QC013,pass,PO000086,PART-001,LOT-00086,2024-01-05 20:25:00,418,M014,OP029,2,PLANT1,in_progress,True,-0.5700326787108938,False,False
M0000087,PART-045,LOT-00087,parallelism,0,0.1,0.0,-0.017,1/25/2024 11:44,CMM2,QC009,fail,PO000087,PART-045,LOT-00087,2024-01-24 13:44:00,257,M002,OP072,1,PLANT1,delayed,False,-0.8801701769946018,False,False
M0000088,PART-008,LOT-00088,thickness,5,5.05,4.95,4.987,1/21/2024 19:34,CMM2,QC008,pass,PO000088,PART-008,LOT-00088,2024-01-21 18:34:00,88,M015,OP086,2,PLANT3,delayed,True,-0.7259949294869845,False,False
M0000089,PART-039,LOT-00089,length,20,20.2,19.8,19.967,1/15/2024 12:34,CMM3,QC014,pass,PO000089,PART-039,LOT-00089,2024-01-15 10:34:00,406,M015,OP079,1,PLANT3,in_progress,True,-0.2644551198019114,False,False
M0000090,PART-028,LOT-00090,parallelism,0,0.1,0.0,0.031,1/27/2024 21:25,CMM2,QC005,pass,PO000090,PART-028,LOT-00090,2024-01-25 22:25:00,248,M006,OP096,3,PLANT2,completed,True,-0.8786912777379341,False,False
M0000091,PART-049,LOT-00091,parallelism,0,0.1,0.0,0.011,1/13/2024 22:03,CMM2,QC007,pass,PO000091,PART-049,LOT-00091,2024-01-12 06:03:00,450,M009,OP099,1,PLANT3,completed,True,-0.8793074857615456,False,False
M0000092,PART-016,LOT-00092,flatness,0,0.1,0.0,-0.018,1/14/2024 6:56,CMM3,QC019,fail,PO000092,PART-016,LOT-00092,2024-01-13 11:56:00,245,M003,OP092,1,PLANT2,completed,False,-0.8802009873957825,False,False
M0000093,PART-022,LOT-00093,outer_diameter,100,100.5,99.5,100.086,1/17/2024 9:12,CMM1,QC017,pass,PO000093,PART-022,LOT-00093,2024-01-15 13:12:00,477,M018,OP011,1,PLANT1,completed,True,2.2040434123848964,False,False
M0000094,PART-025,LOT-00094,angle,45,46.0,44.0,45.032,1/9/2024 21:54,CMM3,QC005,pass,PO000094,PART-025,LOT-00094,2024-01-07 22:54:00,381,M007,OP009,3,PLANT2,completed,True,0.5078075857893009,False,False
M0000095,PART-035,LOT-00095,angle,45,46.0,44.0,45.323,1/22/2024 14:54,CMM1,QC012,pass,PO000095,PART-035,LOT-00095,2024-01-22 04:54:00,232,M002,OP027,3,PLANT2,completed,True,0.5167734125328494,False,False
M0000096,PART-050,LOT-00096,angle,45,46.0,44.0,44.766,1/29/2024 6:58,CMM3,QC007,pass,PO000096,PART-050,LOT-00096,2024-01-27 13:58:00,376,M001,OP098,1,PLANT3,completed,True,0.49961201907526687,False,False
M0000097,PART-001,LOT-00097,width,10,10.1,9.9,9.989,1/18/2024 19:12,CMM2,QC015,pass,PO000097,PART-001,LOT-00097,2024-01-17 00:12:00,172,M013,OP054,3,PLANT3,completed,True,-0.5718813027817284,False,False
M0000098,PART-035,LOT-00098,angle,45,46.0,44.0,44.869,1/29/2024 21:54,CMM1,QC003,pass,PO000098,PART-035,LOT-00098,2024-01-28 10:54:00,479,M008,OP063,1,PLANT1,completed,True,0.5027854903968665,False,False
M0000099,PART-032,LOT-00099,length,20,20.2,19.8,19.902,1/3/2024 9:42,CMM2,QC007,pass,PO000099,PART-032,LOT-00099,2024-01-02 07:42:00,219,M011,OP086,1,PLANT3,completed,True,-0.266457795878649,False,False
M0000100,PART-047,LOT-00100,angle,45,46.0,44.0,45.099,1/10/2024 5:16,CMM3,QC009,pass,PO000100,PART-047,LOT-00100,2024-01-08 12:16:00,450,M015,OP017,1,PLANT3,completed,True,0.5098718826683996,False,False
M0000101,PART-026,LOT-00101,thickness,5,5.05,4.95,5.004,1/27/2024 22:30,CMM2,QC018,pass,PO000101,PART-026,LOT-00101,2024-01-27 22:30:00,308,M001,OP011,3,PLANT3,completed,True,-0.7254711526669148,False,False
M0000102,PART-030,LOT-00102,bore_diameter,50,50.4,49.6,50.001,1/10/2024 3:29,CMM1,QC019,pass,PO000102,PART-030,LOT-00102,2024-01-09 06:29:00,45,M009,OP049,1,PLANT2,completed,True,0.6609044692555979,False,False
M0000103,PART-021,LOT-00103,outer_diameter,100,100.5,99.5,99.961,1/16/2024 12:38,CMM2,QC016,pass,PO000103,PART-021,LOT-00103,2024-01-16 08:38:00,409,M013,OP036,1,PLANT2,completed,True,2.200192112237324,False,False
M0000104,PART-006,LOT-00104,angle,45,46.0,44.0,44.528,1/22/2024 18:42,CMM3,QC009,pass,PO000104,PART-006,LOT-00104,2024-01-22 09:42:00,29,M018,OP007,1,PLANT2,completed,True,0.49227914359428904,False,False
M0000105,PART-005,LOT-00105,thickness,5,5.05,4.95,4.993,1/31/2024 10:53,CMM3,QC006,pass,PO000105,PART-005,LOT-00105,2024-01-30 15:53:00,40,M001,OP032,2,PLANT1,in_progress,True,-0.725810067079901,False,False
M0000106,PART-040,LOT-00106,angle,45,46.0,44.0,44.886,1/8/2024 4:26,CMM2,QC009,pass,PO000106,PART-040,LOT-00106,2024-01-07 22:26:00,142,M005,OP061,3,PLANT3,completed,True,0.5033092672169365,False,False
M0000107,PART-014,LOT-00107,length,20,20.2,19.8,19.947,1/23/2024 22:56,CMM1,QC017,pass,PO000107,PART-014,LOT-00107,2024-01-22 03:56:00,378,M009,OP099,3,PLANT2,completed,True,-0.26507132782552295,False,False
M0000108,PART-039,LOT-00108,angle,45,46.0,44.0,44.946,1/7/2024 11:06,CMM2,QC015,pass,PO000108,PART-039,LOT-00108,2024-01-06 05:06:00,418,M006,OP040,3,PLANT1,completed,True,0.5051578912877711,False,False
M0000109,PART-020,LOT-00109,parallelism,0,0.1,0.0,0.013,1/28/2024 4:55,CMM2,QC019,pass,PO000109,PART-020,LOT-00109,2024-01-27 04:55:00,366,M013,OP051,3,PLANT3,completed,True,-0.8792458649591844,False,False
M0000110,PART-038,LOT-00110,bore_diameter,50,50.4,49.6,50.251,1/30/2024 12:06,CMM2,QC010,pass,PO000110,PART-038,LOT-00110,2024-01-29 13:06:00,144,M004,OP090,1,PLANT2,in_progress,True,0.6686070695507426,False,False
M0000111,PART-039,LOT-00111,thickness,5,5.05,4.95,5.003,1/8/2024 9:13,CMM1,QC010,pass,PO000111,PART-039,LOT-00111,2024-01-06 12:13:00,427,M019,OP006,1,PLANT2,completed,True,-0.7255019630680953,False,False
M0000112,PART-043,LOT-00112,width,10,10.1,9.9,10.009,1/18/2024 23:45,CMM3,QC016,pass,PO000112,PART-043,LOT-00112,2024-01-17 20:45:00,55,M017,OP083,2,PLANT2,completed,True,-0.5712650947581169,False,False
M0000113,PART-027,LOT-00113,parallelism,0,0.1,0.0,-0.002,1/24/2024 9:25,CMM3,QC006,fail,PO000113,PART-027,LOT-00113,2024-01-23 07:25:00,74,M014,OP047,1,PLANT3,in_progress,False,-0.8797080209768932,False,False
M0000114,PART-030,LOT-00114,length,20,20.2,19.8,19.872,1/9/2024 12:06,CMM2,QC020,pass,PO000114,PART-030,LOT-00114,2024-01-07 23:06:00,242,M006,OP094,3,PLANT3,delayed,True,-0.26738210791406636,False,False
M0000115,PART-018,LOT-00115,bore_diameter,50,50.4,49.6,49.996,1/30/2024 20:44,CMM1,QC010,pass,PO000115,PART-018,LOT-00115,2024-01-29 00:44:00,433,M018,OP100,3,PLANT2,completed,True,0.6607504172496951,False,False
M0000116,PART-047,LOT-00116,outer_diameter,100,100.5,99.5,100.01,1/28/2024 22:08,CMM3,QC015,pass,PO000116,PART-047,LOT-00116,2024-01-27 23:08:00,157,M011,OP032,3,PLANT1,completed,True,2.2017018218951727,False,False
M0000117,PART-029,LOT-00117,parallelism,0,0.1,0.0,0.082,1/12/2024 5:21,CMM3,QC002,pass,PO000117,PART-029,LOT-00117,2024-01-12 02:21:00,404,M015,OP073,3,PLANT3,completed,True,-0.8771199472777245,False,False
M0000118,PART-022,LOT-00118,outer_diameter,100,100.5,99.5,99.968,1/3/2024 4:20,CMM3,QC009,pass,PO000118,PART-022,LOT-00118,2024-01-02 07:20:00,273,M011,OP024,1,PLANT2,completed,True,2.2004077850455883,False,False
M0000119,PART-017,LOT-00119,parallelism,0,0.1,0.0,0.01,1/17/2024 1:44,CMM2,QC020,pass,PO000119,PART-017,LOT-00119,2024-01-16 11:44:00,163,M020,OP090,1,PLANT2,completed,True,-0.8793382961627262,False,False
M0000120,PART-034,LOT-00120,thickness,5,5.05,4.95,4.999,1/9/2024 20:41,CMM3,QC009,pass,PO000120,PART-034,LOT-00120,2024-01-09 16:41:00,63,M008,OP093,2,PLANT2,completed,True,-0.7256252046728177,False,False
M0000121,PART-049,LOT-00121,parallelism,0,0.1,0.0,-0.039,1/12/2024 20:29,CMM2,QC015,fail,PO000121,PART-049,LOT-00121,2024-01-11 22:29:00,373,M016,OP083,3,PLANT3,completed,False,-0.8808480058205747,False,False
M0000122,PART-002,LOT-00122,angle,45,46.0,44.0,45.381,1/5/2024 11:38,CMM1,QC011,pass,PO000122,PART-002,LOT-00122,2024-01-05 05:38:00,170,M008,OP052,3,PLANT3,completed,True,0.518560415801323,False,False
M0000123,PART-043,LOT-00123,thickness,5,5.05,4.95,5.013,1/29/2024 9:12,CMM3,QC016,pass,PO000123,PART-043,LOT-00123,2024-01-27 11:12:00,208,M016,OP071,1,PLANT3,completed,True,-0.7251938590562896,False,False
M0000124,PART-048,LOT-00124,thickness,5,5.05,4.95,5.013,1/27/2024 11:10,CMM2,QC012,pass,PO000124,PART-048,LOT-00124,2024-01-26 01:10:00,189,M012,OP090,3,PLANT2,completed,True,-0.7251938590562896,False,False
M0000125,PART-017,LOT-00125,parallelism,0,0.1,0.0,-0.03,1/13/2024 5:48,CMM2,QC005,fail,PO000125,PART-017,LOT-00125,2024-01-11 11:48:00,81,M007,OP041,1,PLANT1,completed,False,-0.8805707122099494,False,False
M0000126,PART-049,LOT-00126,width,10,10.1,9.9,10.047,1/10/2024 20:13,CMM2,QC012,pass,PO000126,PART-049,LOT-00126,2024-01-09 10:13:00,118,M007,OP095,1,PLANT2,completed,True,-0.5700942995132549,False,False
M0000127,PART-038,LOT-00127,angle,45,46.0,44.0,44.533,1/26/2024 16:02,CMM3,QC019,pass,PO000127,PART-038,LOT-00127,2024-01-24 21:02:00,325,M010,OP013,2,PLANT1,completed,True,0.49243319560019205,False,False
M0000128,PART-024,LOT-00128,angle,45,46.0,44.0,45.196,1/10/2024 17:59,CMM2,QC016,pass,PO000128,PART-024,LOT-00128,2024-01-09 03:59:00,174,M001,OP091,3,PLANT3,completed,True,0.5128604915829158,False,False
M0000129,PART-003,LOT-00129,angle,45,46.0,44.0,45.73,1/3/2024 17:33,CMM3,QC014,pass,PO000129,PART-003,LOT-00129,2024-01-03 11:33:00,303,M010,OP090,1,PLANT1,completed,True,0.5293132458133449,False,False
M0000130,PART-049,LOT-00130,flatness,0,0.1,0.0,-0.046,1/24/2024 0:10,CMM3,QC004,fail,PO000130,PART-049,LOT-00130,2024-01-23 08:10:00,72,M001,OP074,1,PLANT2,completed,False,-0.8810636786288386,False,False
M0000131,PART-029,LOT-00131,width,10,10.1,9.9,9.967,1/17/2024 3:08,CMM1,QC010,pass,PO000131,PART-029,LOT-00131,2024-01-16 12:08:00,114,M002,OP033,1,PLANT2,completed,True,-0.5725591316077012,False,False
M0000132,PART-005,LOT-00132,parallelism,0,0.1,0.0,0.114,1/20/2024 6:40,CMM3,QC015,fail,PO000132,PART-005,LOT-00132,2024-01-19 05:40:00,271,M003,OP074,3,PLANT3,completed,False,-0.876134014439946,False,False
M0000133,PART-010,LOT-00133,outer_diameter,100,100.5,99.5,99.906,1/9/2024 1:57,CMM3,QC019,pass,PO000133,PART-010,LOT-00133,2024-01-07 18:57:00,435,M019,OP039,2,PLANT1,delayed,True,2.1984975401723923,False,False
M0000134,PART-008,LOT-00134,parallelism,0,0.1,0.0,0.003,1/28/2024 5:33,CMM1,QC010,pass,PO000134,PART-008,LOT-00134,2024-01-26 09:33:00,411,M014,OP078,1,PLANT3,completed,True,-0.8795539689709903,False,False
M0000135,PART-015,LOT-00135,outer_diameter,100,100.5,99.5,99.916,1/26/2024 15:47,CMM2,QC019,pass,PO000135,PART-015,LOT-00135,2024-01-24 18:47:00,214,M015,OP057,2,PLANT2,in_progress,True,2.1988056441841977,False,False
M0000136,PART-028,LOT-00136,angle,45,46.0,44.0,44.483,1/16/2024 6:33,CMM3,QC007,pass,PO000136,PART-028,LOT-00136,2024-01-14 21:33:00,311,M020,OP008,2,PLANT3,delayed,True,0.49089267554116295,False,False
M0000137,PART-007,LOT-00137,parallelism,0,0.1,0.0,0.002,1/11/2024 9:57,CMM3,QC013,pass,PO000137,PART-007,LOT-00137,2024-01-10 10:57:00,340,M007,OP034,1,PLANT3,completed,True,-0.8795847793721708,False,False
M0000138,PART-016,LOT-00138,bore_diameter,50,50.4,49.6,49.858,1/8/2024 22:51,CMM1,QC020,pass,PO000138,PART-016,LOT-00138,2024-01-08 21:51:00,302,M003,OP021,2,PLANT1,completed,True,0.656498581886775,False,False
M0000139,PART-045,LOT-00139,flatness,0,0.1,0.0,0.016,1/28/2024 4:36,CMM2,QC012,pass,PO000139,PART-045,LOT-00139,2024-01-28 00:36:00,260,M010,OP005,3,PLANT1,completed,True,-0.8791534337556428,False,False
M0000140,PART-019,LOT-00140,bore_diameter,50,50.4,49.6,49.877,1/21/2024 17:55,CMM1,QC015,pass,PO000140,PART-019,LOT-00140,2024-01-21 15:55:00,56,M008,OP034,2,PLANT3,completed,True,0.6570839795092062,False,False
M0000141,PART-013,LOT-00141,bore_diameter,50,50.4,49.6,50.207,1/21/2024 13:21,CMM3,QC009,pass,PO000141,PART-013,LOT-00141,2024-01-20 08:21:00,78,M018,OP029,1,PLANT3,completed,True,0.6672514118987972,False,False
M0000142,PART-018,LOT-00142,bore_diameter,50,50.4,49.6,49.896,1/8/2024 14:21,CMM3,QC020,pass,PO000142,PART-018,LOT-00142,2024-01-07 11:21:00,56,M002,OP022,1,PLANT2,completed,True,0.6576693771316371,False,False
M0000143,PART-037,LOT-00143,length,20,20.2,19.8,19.979,1/14/2024 23:14,CMM2,QC004,pass,PO000143,PART-037,LOT-00143,2024-01-14 03:14:00,244,M004,OP060,3,PLANT3,completed,True,-0.26408539498774447,False,False
M0000144,PART-026,LOT-00144,flatness,0,0.1,0.0,0.027,1/13/2024 18:21,CMM1,QC012,pass,PO000144,PART-026,LOT-00144,2024-01-13 09:21:00,276,M018,OP064,1,PLANT2,completed,True,-0.8788145193426563,False,False
M0000145,PART-003,LOT-00145,width,10,10.1,9.9,9.959,1/22/2024 4:53,CMM2,QC015,pass,PO000145,PART-003,LOT-00145,2024-01-20 15:53:00,396,M011,OP078,2,PLANT2,completed,True,-0.5728056148171459,False,False
M0000146,PART-015,LOT-00146,flatness,0,0.1,0.0,0.008,1/28/2024 2:16,CMM1,QC014,pass,PO000146,PART-015,LOT-00146,2024-01-27 04:16:00,320,M001,OP098,3,PLANT3,in_progress,True,-0.8793999169650873,False,False
M0000147,PART-037,LOT-00147,parallelism,0,0.1,0.0,0.044,1/3/2024 18:56,CMM3,QC012,pass,PO000147,PART-037,LOT-00147,2024-01-02 19:56:00,410,M006,OP061,2,PLANT3,completed,True,-0.8782907425225865,False,False
M0000148,PART-018,LOT-00148,flatness,0,0.1,0.0,0.115,1/10/2024 16:14,CMM3,QC007,fail,PO000148,PART-018,LOT-00148,2024-01-09 06:14:00,319,M014,OP082,1,PLANT2,delayed,False,-0.8761032040387654,False,False
M0000149,PART-031,LOT-00149,thickness,5,5.05,4.95,4.973,1/17/2024 9:03,CMM1,QC012,pass,PO000149,PART-031,LOT-00149,2024-01-16 20:03:00,229,M011,OP042,2,PLANT3,completed,True,-0.7264262751035128,False,False
M0000150,PART-011,LOT-00150,outer_diameter,100,100.5,99.5,100.031,1/17/2024 15:14,CMM1,QC003,pass,PO000150,PART-011,LOT-00150,2024-01-16 00:14:00,230,M016,OP037,3,PLANT3,delayed,True,2.202348840319965,False,False
M0000151,PART-049,LOT-00151,thickness,5,5.05,4.95,5.004,1/27/2024 14:51,CMM2,QC010,pass,PO000151,PART-049,LOT-00151,2024-01-26 00:51:00,38,M015,OP012,3,PLANT2,completed,True,-0.7254711526669148,False,False
M0000152,PART-008,LOT-00152,length,20,20.2,19.8,20.052,1/20/2024 4:28,CMM3,QC008,pass,PO000152,PART-008,LOT-00152,2024-01-19 09:28:00,462,M017,OP001,1,PLANT3,in_progress,True,-0.26183623570156217,False,False
M0000153,PART-030,LOT-00153,flatness,0,0.1,0.0,-0.041,1/21/2024 14:22,CMM1,QC011,fail,PO000153,PART-030,LOT-00153,2024-01-19 19:22:00,47,M007,OP067,2,PLANT2,completed,False,-0.8809096266229357,False,False
M0000154,PART-032,LOT-00154,parallelism,0,0.1,0.0,-0.044,1/31/2024 9:06,CMM3,QC014,fail,PO000154,PART-032,LOT-00154,2024-01-29 11:06:00,246,M002,OP027,1,PLANT2,completed,False,-0.8810020578264774,False,False
M0000155,PART-019,LOT-00155,parallelism,0,0.1,0.0,0.017,1/21/2024 2:32,CMM3,QC009,pass,PO000155,PART-019,LOT-00155,2024-01-20 22:32:00,470,M016,OP016,3,PLANT1,delayed,True,-0.8791226233544621,False,False
M0000156,PART-039,LOT-00156,bore_diameter,50,50.4,49.6,50.04,1/13/2024 15:22,CMM1,QC002,pass,PO000156,PART-039,LOT-00156,2024-01-11 21:22:00,383,M006,OP040,2,PLANT3,completed,True,0.6621060749016404,False,False
M0000157,PART-027,LOT-00157,parallelism,0,0.1,0.0,0.008,1/5/2024 19:48,CMM2,QC014,pass,PO000157,PART-027,LOT-00157,2024-01-05 05:48:00,135,M004,OP060,3,PLANT1,completed,True,-0.8793999169650873,False,False
M0000158,PART-010,LOT-00158,angle,45,46.0,44.0,45.115,1/24/2024 1:21,CMM2,QC001,pass,PO000158,PART-010,LOT-00158,2024-01-23 16:21:00,497,M010,OP066,2,PLANT3,completed,True,0.5103648490872891,False,False
M0000159,PART-031,LOT-00159,length,20,20.2,19.8,19.955,1/23/2024 8:47,CMM1,QC014,pass,PO000159,PART-031,LOT-00159,2024-01-22 11:47:00,144,M015,OP071,1,PLANT1,completed,True,-0.26482484461607836,False,False
M0000160,PART-039,LOT-00160,width,10,10.1,9.9,10.008,1/25/2024 9:08,CMM3,QC009,pass,PO000160,PART-039,LOT-00160,2024-01-24 03:08:00,402,M005,OP009,3,PLANT2,completed,True,-0.5712959051592975,False,False
M0000161,PART-027,LOT-00161,outer_diameter,100,100.5,99.5,100.049,1/17/2024 19:14,CMM3,QC013,pass,PO000161,PART-027,LOT-00161,2024-01-16 11:14:00,498,M017,OP035,1,PLANT1,completed,True,2.2029034275412154,False,False
M0000162,PART-020,LOT-00162,flatness,0,0.1,0.0,-0.024,1/27/2024 23:05,CMM1,QC005,fail,PO000162,PART-020,LOT-00162,2024-01-27 17:05:00,316,M016,OP020,2,PLANT2,completed,False,-0.8803858498028659,False,False
M0000163,PART-023,LOT-00163,length,20,20.2,19.8,20.124,1/16/2024 13:06,CMM1,QC009,pass,PO000163,PART-023,LOT-00163,2024-01-16 03:06:00,302,M018,OP049,3,PLANT2,delayed,True,-0.2596178868165605,False,False
M0000164,PART-013,LOT-00164,length,20,20.2,19.8,20.032,1/12/2024 6:50,CMM2,QC003,pass,PO000164,PART-013,LOT-00164,2024-01-11 20:50:00,312,M013,OP030,2,PLANT2,completed,True,-0.26245244372517373,False,False
M0000165,PART-048,LOT-00165,outer_diameter,100,100.5,99.5,99.801,1/24/2024 5:36,CMM3,QC019,pass,PO000165,PART-048,LOT-00165,2024-01-22 12:36:00,381,M013,OP050,1,PLANT3,completed,True,2.1952624480484313,False,False
M0000166,PART-042,LOT-00166,length,20,20.2,19.8,20.044,1/9/2024 13:08,CMM2,QC013,pass,PO000166,PART-042,LOT-00166,2024-01-07 22:08:00,273,M002,OP017,3,PLANT3,delayed,True,-0.26208271891100676,False,False
M0000167,PART-022,LOT-00167,angle,45,46.0,44.0,44.675,1/6/2024 5:37,CMM3,QC009,pass,PO000167,PART-022,LOT-00167,2024-01-05 13:37:00,467,M015,OP013,1,PLANT3,delayed,True,0.4968082725678341,False,False
M0000168,PART-001,LOT-00168,flatness,0,0.1,0.0,0.026,1/9/2024 9:27,CMM1,QC006,pass,PO000168,PART-001,LOT-00168,2024-01-07 13:27:00,229,M005,OP010,1,PLANT2,completed,True,-0.8788453297438369,False,False
M0000169,PART-017,LOT-00169,angle,45,46.0,44.0,45.386,1/17/2024 5:47,CMM2,QC010,pass,PO000169,PART-017,LOT-00169,2024-01-16 09:47:00,339,M013,OP084,1,PLANT1,in_progress,True,0.518714467807226,False,False
M0000170,PART-044,LOT-00170,outer_diameter,100,100.5,99.5,99.863,1/25/2024 12:51,CMM3,QC018,pass,PO000170,PART-044,LOT-00170,2024-01-25 06:51:00,214,M011,OP081,1,PLANT3,in_progress,True,2.1971726929216273,False,False
M0000171,PART-032,LOT-00171,angle,45,46.0,44.0,45.321,1/26/2024 14:56,CMM2,QC007,pass,PO000171,PART-032,LOT-00171,2024-01-25 14:56:00,38,M020,OP009,2,PLANT1,completed,True,0.5167117917304882,False,False
M0000172,PART-019,LOT-00172,bore_diameter,50,50.4,49.6,50.055,1/11/2024 17:28,CMM1,QC007,pass,PO000172,PART-019,LOT-00172,2024-01-11 08:28:00,402,M003,OP056,1,PLANT1,completed,True,0.6625682309193491,False,False
M0000173,PART-046,LOT-00173,outer_diameter,100,100.5,99.5,100.137,1/6/2024 2:46,CMM2,QC014,pass,PO000173,PART-046,LOT-00173,2024-01-05 13:46:00,247,M006,OP089,1,PLANT2,delayed,True,2.205614742845106,False,False
M0000174,PART-003,LOT-00174,thickness,5,5.05,4.95,5.032,1/17/2024 4:18,CMM2,QC016,pass,PO000174,PART-003,LOT-00174,2024-01-15 18:18:00,427,M002,OP038,2,PLANT2,completed,True,-0.7246084614338585,False,False
M0000175,PART-010,LOT-00175,outer_diameter,100,100.5,99.5,99.959,1/13/2024 20:43,CMM1,QC006,pass,PO000175,PART-010,LOT-00175,2024-01-12 02:43:00,291,M014,OP073,3,PLANT3,completed,True,2.200130491434963,False,False
M0000176,PART-011,LOT-00176,bore_diameter,50,50.4,49.6,49.9,1/9/2024 15:13,CMM3,QC017,pass,PO000176,PART-011,LOT-00176,2024-01-08 23:13:00,60,M020,OP049,3,PLANT3,completed,True,0.6577926187363594,False,False
M0000177,PART-032,LOT-00177,width,10,10.1,9.9,9.97,1/28/2024 8:57,CMM2,QC002,pass,PO000177,PART-032,LOT-00177,2024-01-27 12:57:00,93,M008,OP060,1,PLANT3,completed,True,-0.5724667004041595,False,False
M0000178,PART-017,LOT-00178,outer_diameter,100,100.5,99.5,99.864,1/2/2024 14:15,CMM1,QC018,pass,PO000178,PART-017,LOT-00178,2024-01-01 10:15:00,480,M015,OP037,1,PLANT3,completed,True,2.197203503322808,False,False
M0000179,PART-005,LOT-00179,width,10,10.1,9.9,9.997,1/21/2024 2:29,CMM1,QC001,pass,PO000179,PART-005,LOT-00179,2024-01-21 02:29:00,196,M019,OP039,3,PLANT3,delayed,True,-0.5716348195722839,False,False
M0000180,PART-045,LOT-00180,parallelism,0,0.1,0.0,0.011,1/13/2024 10:10,CMM2,QC015,pass,PO000180,PART-045,LOT-00180,2024-01-12 09:10:00,253,M010,OP026,1,PLANT2,in_progress,True,-0.8793074857615456,False,False
M0000181,PART-007,LOT-00181,parallelism,0,0.1,0.0,-0.05,1/13/2024 13:05,CMM3,QC016,fail,PO000181,PART-007,LOT-00181,2024-01-11 19:05:00,215,M019,OP046,2,PLANT3,completed,False,-0.8811869202335609,False,False
M0000182,PART-045,LOT-00182,flatness,0,0.1,0.0,0.009,1/15/2024 20:28,CMM1,QC015,pass,PO000182,PART-045,LOT-00182,2024-01-14 10:28:00,31,M013,OP036,1,PLANT1,completed,True,-0.8793691065639068,False,False
M0000183,PART-044,LOT-00183,flatness,0,0.1,0.0,0.028,1/4/2024 19:34,CMM2,QC001,pass,PO000183,PART-044,LOT-00183,2024-01-03 05:34:00,486,M020,OP096,3,PLANT2,in_progress,True,-0.8787837089414758,False,False
M0000184,PART-019,LOT-00184,parallelism,0,0.1,0.0,0.0,1/12/2024 17:21,CMM3,QC003,pass,PO000184,PART-019,LOT-00184,2024-01-11 11:21:00,330,M012,OP029,1,PLANT3,completed,True,-0.879646400174532,False,False
M0000185,PART-017,LOT-00185,flatness,0,0.1,0.0,0.048,1/31/2024 6:00,CMM2,QC005,pass,PO000185,PART-017,LOT-00185,2024-01-31 00:00:00,368,M005,OP081,3,PLANT1,delayed,True,-0.8781675009178642,False,False
M0000186,PART-042,LOT-00186,bore_diameter,50,50.4,49.6,49.965,1/4/2024 4:03,CMM3,QC013,pass,PO000186,PART-042,LOT-00186,2024-01-02 19:03:00,178,M015,OP005,2,PLANT3,completed,True,0.6597952948130972,False,False
M0000187,PART-009,LOT-00187,bore_diameter,50,50.4,49.6,50.363,1/5/2024 8:26,CMM3,QC013,pass,PO000187,PART-009,LOT-00187,2024-01-05 02:26:00,485,M010,OP042,3,PLANT3,completed,True,0.6720578344829675,False,False
M0000188,PART-013,LOT-00188,width,10,10.1,9.9,9.863,1/8/2024 0:21,CMM2,QC011,fail,PO000188,PART-013,LOT-00188,2024-01-07 00:21:00,422,M018,OP047,3,PLANT3,completed,False,-0.5757634133304814,False,False
M0000189,PART-018,LOT-00189,flatness,0,0.1,0.0,0.021,1/9/2024 14:43,CMM2,QC010,pass,PO000189,PART-018,LOT-00189,2024-01-08 11:43:00,151,M016,OP038,1,PLANT3,in_progress,True,-0.8789993817497398,False,False
M0000190,PART-008,LOT-00190,outer_diameter,100,100.5,99.5,99.857,1/22/2024 12:32,CMM2,QC002,pass,PO000190,PART-008,LOT-00190,2024-01-22 07:32:00,58,M005,OP097,1,PLANT1,in_progress,True,2.196987830514544,False,False
M0000191,PART-047,LOT-00191,angle,45,46.0,44.0,44.643,1/20/2024 21:04,CMM1,QC020,pass,PO000191,PART-047,LOT-00191,2024-01-19 02:04:00,453,M018,OP047,3,PLANT1,completed,True,0.4958223397300557,False,False
M0000192,PART-001,LOT-00192,bore_diameter,50,50.4,49.6,50.064,1/13/2024 16:51,CMM3,QC002,pass,PO000192,PART-001,LOT-00192,2024-01-13 00:51:00,294,M004,OP059,3,PLANT2,completed,True,0.6628455245299744,False,False
M0000193,PART-044,LOT-00193,parallelism,0,0.1,0.0,-0.007,1/13/2024 12:21,CMM2,QC005,fail,PO000193,PART-044,LOT-00193,2024-01-12 22:21:00,319,M013,OP082,3,PLANT2,completed,False,-0.8798620729827961,False,False
M0000194,PART-015,LOT-00194,angle,45,46.0,44.0,45.238,1/22/2024 17:58,CMM3,QC020,pass,PO000194,PART-015,LOT-00194,2024-01-22 10:58:00,32,M020,OP072,1,PLANT2,delayed,True,0.5141545284325002,False,False
M0000195,PART-015,LOT-00195,parallelism,0,0.1,0.0,0.016,1/30/2024 18:24,CMM3,QC003,pass,PO000195,PART-015,LOT-00195,2024-01-30 11:24:00,52,M015,OP090,1,PLANT2,completed,True,-0.8791534337556428,False,False
M0000196,PART-008,LOT-00196,angle,45,46.0,44.0,44.976,1/7/2024 14:40,CMM1,QC013,pass,PO000196,PART-008,LOT-00196,2024-01-07 08:40:00,43,M002,OP039,1,PLANT2,completed,True,0.5060822033231884,False,False
M0000197,PART-016,LOT-00197,length,20,20.2,19.8,19.944,1/26/2024 16:08,CMM1,QC015,pass,PO000197,PART-016,LOT-00197,2024-01-25 11:08:00,89,M013,OP059,1,PLANT2,completed,True,-0.2651637590290647,False,False
M0000198,PART-048,LOT-00198,thickness,5,5.05,4.95,4.975,1/26/2024 11:02,CMM1,QC003,pass,PO000198,PART-048,LOT-00198,2024-01-25 14:02:00,234,M019,OP096,2,PLANT3,completed,True,-0.7263646543011515,False,False
M0000199,PART-027,LOT-00199,width,10,10.1,9.9,9.985,1/31/2024 20:20,CMM3,QC005,pass,PO000199,PART-027,LOT-00199,2024-01-30 19:20:00,70,M016,OP079,2,PLANT2,delayed,True,-0.5720045443864509,False,False
M0000200,PART-018,LOT-00200,angle,45,46.0,44.0,45.285,1/3/2024 12:44,CMM1,QC005,pass,PO000200,PART-018,LOT-00200,2024-01-02 11:44:00,373,M012,OP028,1,PLANT2,completed,True,0.5156026172879873,False,False
M0000201,PART-016,LOT-00201,length,20,20.2,19.8,20.014,1/19/2024 0:08,CMM3,QC001,pass,PO000201,PART-016,LOT-00201,2024-01-17 12:08:00,70,M012,OP070,1,PLANT3,completed,True,-0.2630070309464242,False,False
M0000202,PART-026,LOT-00202,parallelism,0,0.1,0.0,-0.042,1/14/2024 6:20,CMM3,QC001,fail,PO000202,PART-026,LOT-00202,2024-01-13 13:20:00,117,M004,OP059,1,PLANT1,completed,False,-0.8809404370241164,False,False
M0000203,PART-042,LOT-00203,length,20,20.2,19.8,20.012,1/31/2024 16:29,CMM1,QC007,pass,PO000203,PART-042,LOT-00203,2024-01-30 02:29:00,325,M001,OP007,3,PLANT2,completed,True,-0.2630686517487853,False,False
M0000204,PART-009,LOT-00204,angle,45,46.0,44.0,45.128,1/28/2024 16:40,CMM3,QC010,pass,PO000204,PART-009,LOT-00204,2024-01-26 16:40:00,125,M003,OP098,2,PLANT3,completed,True,0.5107653843026365,False,False
M0000205,PART-014,LOT-00205,width,10,10.1,9.9,9.971,1/13/2024 5:29,CMM3,QC003,pass,PO000205,PART-014,LOT-00205,2024-01-11 14:29:00,188,M005,OP077,2,PLANT1,completed,True,-0.5724358900029789,False,False
M0000206,PART-010,LOT-00206,bore_diameter,50,50.4,49.6,50.02,1/8/2024 1:59,CMM1,QC011,pass,PO000206,PART-010,LOT-00206,2024-01-06 21:59:00,296,M009,OP023,2,PLANT1,completed,True,0.661489866878029,False,False
M0000207,PART-002,LOT-00207,outer_diameter,100,100.5,99.5,100.01,1/7/2024 20:57,CMM2,QC013,pass,PO000207,PART-002,LOT-00207,2024-01-06 23:57:00,27,M012,OP031,3,PLANT3,completed,True,2.2017018218951727,False,False
M0000208,PART-012,LOT-00208,width,10,10.1,9.9,9.962,1/14/2024 22:51,CMM2,QC004,pass,PO000208,PART-012,LOT-00208,2024-01-13 01:51:00,46,M005,OP095,3,PLANT2,completed,True,-0.5727131836136041,False,False
M0000209,PART-048,LOT-00209,bore_diameter,50,50.4,49.6,50.048,1/5/2024 20:25,CMM1,QC010,pass,PO000209,PART-048,LOT-00209,2024-01-03 21:25:00,263,M015,OP100,2,PLANT2,completed,True,0.6623525581110852,False,False
M0000210,PART-007,LOT-00210,bore_diameter,50,50.4,49.6,50.075,1/23/2024 13:42,CMM1,QC005,pass,PO000210,PART-007,LOT-00210,2024-01-21 13:42:00,277,M008,OP079,1,PLANT1,completed,True,0.6631844389429609,False,False
M0000211,PART-043,LOT-00211,width,10,10.1,9.9,10.036,1/26/2024 5:33,CMM2,QC012,pass,PO000211,PART-043,LOT-00211,2024-01-24 17:33:00,174,M015,OP083,2,PLANT1,completed,True,-0.5704332139262412,False,False
M0000212,PART-031,LOT-00212,parallelism,0,0.1,0.0,0.035,1/19/2024 6:40,CMM1,QC011,pass,PO000212,PART-031,LOT-00212,2024-01-19 06:40:00,238,M004,OP063,1,PLANT3,delayed,True,-0.8785680361332117,False,False
M0000213,PART-005,LOT-00213,parallelism,0,0.1,0.0,-0.046,1/5/2024 23:14,CMM1,QC016,fail,PO000213,PART-005,LOT-00213,2024-01-04 16:14:00,184,M020,OP019,2,PLANT1,completed,False,-0.8810636786288386,False,False
M0000214,PART-040,LOT-00214,bore_diameter,50,50.4,49.6,49.875,1/30/2024 17:29,CMM2,QC017,pass,PO000214,PART-040,LOT-00214,2024-01-29 19:29:00,319,M018,OP092,2,PLANT2,completed,True,0.6570223587068449,False,False
M0000215,PART-039,LOT-00215,parallelism,0,0.1,0.0,0.017,1/26/2024 15:30,CMM2,QC003,pass,PO000215,PART-039,LOT-00215,2024-01-25 03:30:00,170,M015,OP065,3,PLANT3,completed,True,-0.8791226233544621,False,False
M0000216,PART-045,LOT-00216,length,20,20.2,19.8,20.034,1/8/2024 0:58,CMM2,QC001,pass,PO000216,PART-045,LOT-00216,2024-01-06 04:58:00,456,M018,OP093,3,PLANT1,completed,True,-0.2623908229228126,False,False
M0000217,PART-015,LOT-00217,angle,45,46.0,44.0,45.172,1/20/2024 20:59,CMM2,QC018,pass,PO000217,PART-015,LOT-00217,2024-01-19 19:59:00,193,M015,OP052,2,PLANT2,completed,True,0.5121210419545819,False,False
M0000218,PART-021,LOT-00218,width,10,10.1,9.9,10.128,1/22/2024 2:08,CMM3,QC019,fail,PO000218,PART-021,LOT-00218,2024-01-20 10:08:00,180,M009,OP048,1,PLANT1,completed,False,-0.567598657017628,False,False
M0000219,PART-031,LOT-00219,angle,45,46.0,44.0,45.19,1/5/2024 5:19,CMM2,QC018,pass,PO000219,PART-031,LOT-00219,2024-01-04 01:19:00,66,M003,OP012,3,PLANT2,completed,True,0.5126756291758323,False,False
M0000220,PART-048,LOT-00220,thickness,5,5.05,4.95,5.019,1/19/2024 10:01,CMM2,QC013,pass,PO000220,PART-048,LOT-00220,2024-01-17 23:01:00,435,M005,OP072,3,PLANT1,completed,True,-0.7250089966492061,False,False
M0000221,PART-036,LOT-00221,parallelism,0,0.1,0.0,0.032,1/28/2024 7:30,CMM2,QC002,pass,PO000221,PART-036,LOT-00221,2024-01-26 13:30:00,188,M004,OP053,1,PLANT2,in_progress,True,-0.8786604673367534,False,False
M0000222,PART-049,LOT-00222,bore_diameter,50,50.4,49.6,50.087,1/20/2024 19:57,CMM2,QC011,pass,PO000222,PART-049,LOT-00222,2024-01-20 05:57:00,464,M002,OP037,3,PLANT3,completed,True,0.6635541637571278,False,False
M0000223,PART-007,LOT-00223,parallelism,0,0.1,0.0,-0.011,1/29/2024 1:14,CMM1,QC003,fail,PO000223,PART-007,LOT-00223,2024-01-27 07:14:00,279,M007,OP020,1,PLANT3,completed,False,-0.8799853145875183,False,False
M0000224,PART-007,LOT-00224,parallelism,0,0.1,0.0,0.025,1/17/2024 0:25,CMM1,QC008,pass,PO000224,PART-007,LOT-00224,2024-01-16 22:25:00,452,M018,OP048,3,PLANT1,completed,True,-0.8788761401450176,False,False
M0000225,PART-037,LOT-00225,length,20,20.2,19.8,19.948,1/12/2024 9:01,CMM3,QC015,pass,PO000225,PART-037,LOT-00225,2024-01-11 07:01:00,433,M014,OP072,1,PLANT3,completed,True,-0.26504051742434237,False,False
M0000226,PART-042,LOT-00226,angle,45,46.0,44.0,44.921,1/27/2024 15:06,CMM2,QC011,pass,PO000226,PART-042,LOT-00226,2024-01-26 08:06:00,33,M020,OP085,1,PLANT3,completed,True,0.5043876312582566,False,False
M0000227,PART-012,LOT-00227,outer_diameter,100,100.5,99.5,99.919,1/14/2024 5:29,CMM3,QC009,pass,PO000227,PART-012,LOT-00227,2024-01-13 10:29:00,379,M010,OP044,1,PLANT2,completed,True,2.1988980753877394,False,False
M0000228,PART-010,LOT-00228,bore_diameter,50,50.4,49.6,50.011,1/28/2024 14:34,CMM2,QC007,pass,PO000228,PART-010,LOT-00228,2024-01-26 18:34:00,356,M013,OP009,2,PLANT1,completed,True,0.6612125732674038,False,False
M0000229,PART-002,LOT-00229,outer_diameter,100,100.5,99.5,100.386,1/6/2024 2:13,CMM2,QC001,pass,PO000229,PART-002,LOT-00229,2024-01-05 04:13:00,402,M017,OP028,3,PLANT2,completed,True,2.21328653273907,False,True
M0000230,PART-022,LOT-00230,angle,45,46.0,44.0,44.378,1/8/2024 13:55,CMM2,QC002,pass,PO000230,PART-022,LOT-00230,2024-01-08 03:55:00,209,M010,OP093,3,PLANT2,completed,True,0.4876575834172023,False,False
M0000231,PART-037,LOT-00231,parallelism,0,0.1,0.0,0.023,1/29/2024 16:14,CMM2,QC019,pass,PO000231,PART-037,LOT-00231,2024-01-28 03:14:00,63,M002,OP020,3,PLANT1,completed,True,-0.8789377609473786,False,False
M0000232,PART-004,LOT-00232,thickness,5,5.05,4.95,4.973,1/5/2024 19:06,CMM1,QC004,pass,PO000232,PART-004,LOT-00232,2024-01-04 17:06:00,159,M015,OP085,2,PLANT2,completed,True,-0.7264262751035128,False,False
M0000233,PART-029,LOT-00233,outer_diameter,100,100.5,99.5,99.921,1/21/2024 8:23,CMM2,QC013,pass,PO000233,PART-029,LOT-00233,2024-01-19 20:23:00,159,M007,OP097,2,PLANT3,completed,True,2.198959696190101,False,False
M0000234,PART-028,LOT-00234,thickness,5,5.05,4.95,5.018,1/7/2024 0:07,CMM2,QC012,pass,PO000234,PART-028,LOT-00234,2024-01-06 01:07:00,165,M019,OP063,3,PLANT3,completed,True,-0.7250398070503866,False,False
M0000235,PART-003,LOT-00235,flatness,0,0.1,0.0,0.002,1/11/2024 9:51,CMM3,QC019,pass,PO000235,PART-003,LOT-00235,2024-01-11 00:51:00,222,M020,OP008,3,PLANT1,completed,True,-0.8795847793721708,False,False
M0000236,PART-014,LOT-00236,parallelism,0,0.1,0.0,-0.036,1/8/2024 5:53,CMM3,QC019,fail,PO000236,PART-014,LOT-00236,2024-01-07 05:53:00,411,M009,OP038,3,PLANT2,completed,False,-0.8807555746170329,False,False
M0000237,PART-032,LOT-00237,width,10,10.1,9.9,9.976,1/21/2024 11:23,CMM2,QC001,pass,PO000237,PART-032,LOT-00237,2024-01-20 14:23:00,109,M005,OP049,2,PLANT3,completed,True,-0.572281837997076,False,False
M0000238,PART-033,LOT-00238,width,10,10.1,9.9,10.023,1/28/2024 0:16,CMM3,QC009,pass,PO000238,PART-033,LOT-00238,2024-01-26 10:16:00,446,M012,OP010,1,PLANT2,in_progress,True,-0.5708337491415888,False,False
M0000239,PART-003,LOT-00239,flatness,0,0.1,0.0,-0.024,1/21/2024 18:28,CMM3,QC014,fail,PO000239,PART-003,LOT-00239,2024-01-20 20:28:00,29,M015,OP010,2,PLANT2,completed,False,-0.8803858498028659,False,False
M0000240,PART-037,LOT-00240,bore_diameter,50,50.4,49.6,50.029,1/20/2024 9:44,CMM3,QC019,pass,PO000240,PART-037,LOT-00240,2024-01-19 09:44:00,383,M014,OP038,1,PLANT1,completed,True,0.6617671604886542,False,False
M0000241,PART-021,LOT-00241,length,20,20.2,19.8,20.003,1/10/2024 12:43,CMM3,QC014,pass,PO000241,PART-021,LOT-00241,2024-01-08 19:43:00,430,M020,OP059,2,PLANT3,delayed,True,-0.2633459453594105,False,False
M0000242,PART-006,LOT-00242,outer_diameter,100,100.5,99.5,99.891,1/21/2024 5:00,CMM2,QC018,pass,PO000242,PART-006,LOT-00242,2024-01-20 21:00:00,452,M004,OP032,2,PLANT2,completed,True,2.1980353841546836,False,False
M0000243,PART-034,LOT-00243,parallelism,0,0.1,0.0,-0.028,1/5/2024 17:54,CMM2,QC015,fail,PO000243,PART-034,LOT-00243,2024-01-04 13:54:00,222,M010,OP096,1,PLANT2,completed,False,-0.8805090914075882,False,False
M0000244,PART-050,LOT-00244,angle,45,46.0,44.0,45.715,1/10/2024 15:38,CMM3,QC007,pass,PO000244,PART-050,LOT-00244,2024-01-08 15:38:00,59,M017,OP082,2,PLANT1,completed,True,0.5288510897956364,False,False
M0000245,PART-013,LOT-00245,flatness,0,0.1,0.0,0.021,1/17/2024 11:36,CMM2,QC015,pass,PO000245,PART-013,LOT-00245,2024-01-16 21:36:00,199,M005,OP031,2,PLANT1,completed,True,-0.8789993817497398,False,False
M0000246,PART-013,LOT-00246,length,20,20.2,19.8,19.865,1/10/2024 21:30,CMM2,QC003,pass,PO000246,PART-013,LOT-00246,2024-01-08 21:30:00,328,M005,OP098,2,PLANT3,completed,True,-0.2675977807223305,False,False
M0000247,PART-050,LOT-00247,outer_diameter,100,100.5,99.5,100.031,1/30/2024 17:53,CMM1,QC012,pass,PO000247,PART-050,LOT-00247,2024-01-29 13:53:00,272,M015,OP097,1,PLANT3,completed,True,2.202348840319965,False,False
M0000248,PART-029,LOT-00248,outer_diameter,100,100.5,99.5,99.89,1/28/2024 6:34,CMM2,QC006,pass,PO000248,PART-029,LOT-00248,2024-01-26 16:34:00,349,M020,OP042,2,PLANT3,completed,True,2.198004573753503,False,False
M0000249,PART-029,LOT-00249,length,20,20.2,19.8,20.057,1/4/2024 4:35,CMM2,QC018,pass,PO000249,PART-029,LOT-00249,2024-01-04 02:35:00,260,M015,OP081,3,PLANT2,completed,True,-0.2616821836956593,False,False
M0000250,PART-038,LOT-00250,length,20,20.2,19.8,19.947,1/3/2024 23:21,CMM1,QC007,pass,PO000250,PART-038,LOT-00250,2024-01-03 13:21:00,200,M017,OP010,1,PLANT2,completed,True,-0.26507132782552295,False,False
M0000251,PART-003,LOT-00251,width,10,10.1,9.9,9.996,1/3/2024 23:08,CMM1,QC020,pass,PO000251,PART-003,LOT-00251,2024-01-03 14:08:00,208,M010,OP010,2,PLANT3,in_progress,True,-0.5716656299734644,False,False
M0000252,PART-006,LOT-00252,width,10,10.1,9.9,10.017,1/29/2024 23:45,CMM1,QC013,pass,PO000252,PART-006,LOT-00252,2024-01-28 23:45:00,324,M017,OP050,3,PLANT2,completed,True,-0.5710186115486723,False,False
M0000253,PART-048,LOT-00253,bore_diameter,50,50.4,49.6,50.115,1/3/2024 20:48,CMM3,QC009,pass,PO000253,PART-048,LOT-00253,2024-01-02 20:48:00,250,M019,OP084,2,PLANT1,completed,True,0.664416854990184,False,False
M0000254,PART-031,LOT-00254,width,10,10.1,9.9,9.96,1/23/2024 19:37,CMM2,QC020,pass,PO000254,PART-031,LOT-00254,2024-01-23 19:37:00,97,M002,OP058,2,PLANT1,in_progress,True,-0.5727748044159653,False,False
M0000255,PART-022,LOT-00255,angle,45,46.0,44.0,44.888,1/5/2024 8:06,CMM2,QC015,pass,PO000255,PART-022,LOT-00255,2024-01-04 20:06:00,278,M006,OP006,2,PLANT1,completed,True,0.5033708880192975,False,False
M0000256,PART-029,LOT-00256,flatness,0,0.1,0.0,-0.016,1/25/2024 4:25,CMM3,QC010,fail,PO000256,PART-029,LOT-00256,2024-01-24 20:25:00,287,M020,OP021,2,PLANT2,completed,False,-0.8801393665934212,False,False
M0000257,PART-019,LOT-00257,outer_diameter,100,100.5,99.5,99.891,1/19/2024 12:09,CMM1,QC016,pass,PO000257,PART-019,LOT-00257,2024-01-18 15:09:00,229,M011,OP087,2,PLANT3,completed,True,2.1980353841546836,False,False
M0000258,PART-041,LOT-00258,bore_diameter,50,50.4,49.6,50.589,1/31/2024 3:01,CMM3,QC018,fail,PO000258,PART-041,LOT-00258,2024-01-30 11:01:00,191,M003,OP043,1,PLANT1,completed,False,0.6790209851497783,False,False
M0000259,PART-025,LOT-00259,angle,45,46.0,44.0,45.588,1/15/2024 4:21,CMM2,QC008,pass,PO000259,PART-025,LOT-00259,2024-01-13 22:21:00,149,M020,OP020,3,PLANT2,completed,True,0.5249381688457029,False,False
M0000260,PART-043,LOT-00260,outer_diameter,100,100.5,99.5,100.067,1/8/2024 23:28,CMM3,QC017,pass,PO000260,PART-043,LOT-00260,2024-01-07 10:28:00,489,M012,OP040,1,PLANT3,completed,True,2.2034580147624654,False,False
M0000261,PART-026,LOT-00261,bore_diameter,50,50.4,49.6,49.832,1/7/2024 19:50,CMM2,QC010,pass,PO000261,PART-026,LOT-00261,2024-01-06 20:50:00,324,M003,OP040,2,PLANT3,completed,True,0.65569751145608,False,False
M0000262,PART-022,LOT-00262,length,20,20.2,19.8,20.061,1/6/2024 19:35,CMM2,QC008,pass,PO000262,PART-022,LOT-00262,2024-01-06 19:35:00,363,M017,OP012,2,PLANT3,completed,True,-0.26155894209093694,False,False
M0000263,PART-033,LOT-00263,parallelism,0,0.1,0.0,0.071,1/18/2024 6:12,CMM1,QC012,pass,PO000263,PART-033,LOT-00263,2024-01-17 11:12:00,29,M012,OP040,1,PLANT1,delayed,True,-0.8774588616907109,False,False
M0000264,PART-022,LOT-00264,angle,45,46.0,44.0,45.344,1/24/2024 9:08,CMM3,QC014,pass,PO000264,PART-022,LOT-00264,2024-01-23 03:08:00,118,M008,OP018,3,PLANT1,completed,True,0.5174204309576416,False,False
M0000265,PART-007,LOT-00265,parallelism,0,0.1,0.0,-0.051,1/24/2024 3:31,CMM3,QC006,fail,PO000265,PART-007,LOT-00265,2024-01-24 02:31:00,414,M018,OP095,3,PLANT3,completed,False,-0.8812177306347415,False,False
M0000266,PART-022,LOT-00266,bore_diameter,50,50.4,49.6,49.935,1/30/2024 16:03,CMM1,QC006,pass,PO000266,PART-022,LOT-00266,2024-01-29 03:03:00,87,M020,OP049,3,PLANT1,completed,True,0.6588709827776797,False,False
M0000267,PART-045,LOT-00267,outer_diameter,100,100.5,99.5,100.211,1/29/2024 14:22,CMM2,QC002,pass,PO000267,PART-045,LOT-00267,2024-01-29 10:22:00,434,M006,OP093,1,PLANT2,completed,True,2.2078947125324686,False,False
M0000268,PART-024,LOT-00268,outer_diameter,100,100.5,99.5,99.882,1/13/2024 16:26,CMM2,QC018,pass,PO000268,PART-024,LOT-00268,2024-01-11 19:26:00,247,M020,OP037,2,PLANT3,completed,True,2.1977580905440584,False,False
M0000269,PART-015,LOT-00269,flatness,0,0.1,0.0,0.015,1/25/2024 20:16,CMM3,QC019,pass,PO000269,PART-015,LOT-00269,2024-01-25 07:16:00,142,M010,OP061,1,PLANT1,completed,True,-0.8791842441568233,False,False
M0000270,PART-037,LOT-00270,length,20,20.2,19.8,20.052,1/22/2024 7:14,CMM3,QC017,pass,PO000270,PART-037,LOT-00270,2024-01-21 01:14:00,256,M010,OP100,3,PLANT2,completed,True,-0.26183623570156217,False,False
M0000271,PART-027,LOT-00271,parallelism,0,0.1,0.0,-0.031,1/9/2024 18:00,CMM2,QC007,fail,PO000271,PART-027,LOT-00271,2024-01-08 09:00:00,438,M007,OP078,1,PLANT1,in_progress,False,-0.8806015226111299,False,False
M0000272,PART-004,LOT-00272,outer_diameter,100,100.5,99.5,99.99,1/30/2024 14:20,CMM2,QC019,pass,PO000272,PART-004,LOT-00272,2024-01-30 04:20:00,266,M012,OP071,3,PLANT1,completed,True,2.2010856138715607,False,False
M0000273,PART-034,LOT-00273,angle,45,46.0,44.0,43.92,1/7/2024 3:10,CMM3,QC004,fail,PO000273,PART-034,LOT-00273,2024-01-06 16:10:00,165,M003,OP098,2,PLANT1,completed,False,0.47354641967649713,False,True
M0000274,PART-033,LOT-00274,parallelism,0,0.1,0.0,-0.034,1/9/2024 4:56,CMM2,QC010,fail,PO000274,PART-033,LOT-00274,2024-01-07 16:56:00,445,M014,OP012,2,PLANT1,in_progress,False,-0.8806939538146716,False,False
M0000275,PART-023,LOT-00275,thickness,5,5.05,4.95,4.996,1/2/2024 5:07,CMM1,QC007,pass,PO000275,PART-023,LOT-00275,2024-01-02 05:07:00,232,M002,OP051,3,PLANT3,completed,True,-0.7257176358763593,False,False
M0000276,PART-025,LOT-00276,length,20,20.2,19.8,19.917,1/6/2024 1:08,CMM1,QC016,pass,PO000276,PART-025,LOT-00276,2024-01-04 17:08:00,211,M008,OP004,2,PLANT2,delayed,True,-0.26599563986094027,False,False
M0000277,PART-046,LOT-00277,bore_diameter,50,50.4,49.6,50.418,1/31/2024 22:55,CMM2,QC010,fail,PO000277,PART-046,LOT-00277,2024-01-30 13:55:00,191,M005,OP018,1,PLANT1,completed,False,0.6737524065478993,False,False
M0000278,PART-031,LOT-00278,angle,45,46.0,44.0,45.544,1/7/2024 16:35,CMM1,QC005,pass,PO000278,PART-031,LOT-00278,2024-01-07 07:35:00,408,M016,OP058,1,PLANT3,completed,True,0.5235825111937572,False,False
M0000279,PART-006,LOT-00279,length,20,20.2,19.8,19.905,1/3/2024 13:45,CMM1,QC003,pass,PO000279,PART-006,LOT-00279,2024-01-01 20:45:00,151,M007,OP020,2,PLANT3,delayed,True,-0.26636536467510724,False,False
M0000280,PART-039,LOT-00280,parallelism,0,0.1,0.0,-0.015,1/25/2024 23:28,CMM2,QC003,fail,PO000280,PART-039,LOT-00280,2024-01-25 00:28:00,236,M004,OP100,3,PLANT2,completed,False,-0.8801085561922407,False,False
M0000281,PART-008,LOT-00281,flatness,0,0.1,0.0,0.004,1/4/2024 11:09,CMM3,QC005,pass,PO000281,PART-008,LOT-00281,2024-01-03 04:09:00,142,M014,OP082,3,PLANT3,completed,True,-0.8795231585698097,False,False
M0000282,PART-008,LOT-00282,outer_diameter,100,100.5,99.5,100.24,1/24/2024 10:56,CMM2,QC014,pass,PO000282,PART-008,LOT-00282,2024-01-23 17:56:00,325,M018,OP003,2,PLANT3,completed,True,2.2087882141667055,False,False
M0000283,PART-016,LOT-00283,length,20,20.2,19.8,19.904,1/8/2024 8:49,CMM3,QC001,pass,PO000283,PART-016,LOT-00283,2024-01-07 12:49:00,169,M014,OP001,1,PLANT3,completed,True,-0.2663961750762878,False,False
M0000284,PART-037,LOT-00284,outer_diameter,100,100.5,99.5,100.194,1/21/2024 0:00,CMM3,QC019,pass,PO000284,PART-037,LOT-00284,2024-01-19 23:00:00,115,M003,OP068,3,PLANT2,completed,True,2.207370935712399,False,False
M0000285,PART-034,LOT-00285,parallelism,0,0.1,0.0,0.0,1/26/2024 4:16,CMM1,QC008,pass,PO000285,PART-034,LOT-00285,2024-01-25 18:16:00,279,M017,OP071,2,PLANT1,completed,True,-0.879646400174532,False,False
M0000286,PART-031,LOT-00286,flatness,0,0.1,0.0,-0.033,1/4/2024 9:33,CMM2,QC010,fail,PO000286,PART-031,LOT-00286,2024-01-02 23:33:00,345,M013,OP048,3,PLANT2,completed,False,-0.8806631434134912,False,False
M0000287,PART-023,LOT-00287,width,10,10.1,9.9,10.015,1/5/2024 13:47,CMM2,QC017,pass,PO000287,PART-023,LOT-00287,2024-01-04 01:47:00,196,M008,OP094,3,PLANT3,completed,True,-0.5710802323510334,False,False
M0000288,PART-050,LOT-00288,parallelism,0,0.1,0.0,0.007,1/28/2024 2:35,CMM3,QC018,pass,PO000288,PART-050,LOT-00288,2024-01-27 11:35:00,396,M011,OP018,1,PLANT1,completed,True,-0.8794307273662679,False,False
M0000289,PART-022,LOT-00289,width,10,10.1,9.9,9.98,2/1/2024 3:06,CMM3,QC001,pass,PO000289,PART-022,LOT-00289,2024-01-30 06:06:00,109,M015,OP090,1,PLANT2,completed,True,-0.5721585963923537,False,False
M0000290,PART-009,LOT-00290,flatness,0,0.1,0.0,0.12,1/5/2024 0:55,CMM3,QC005,fail,PO000290,PART-009,LOT-00290,2024-01-03 20:55:00,386,M015,OP005,2,PLANT2,completed,False,-0.8759491520328625,False,False
M0000291,PART-013,LOT-00291,width,10,10.1,9.9,10.002,1/4/2024 4:46,CMM1,QC009,pass,PO000291,PART-013,LOT-00291,2024-01-02 21:46:00,181,M010,OP066,2,PLANT2,delayed,True,-0.5714807675663809,False,False
M0000292,PART-035,LOT-00292,angle,45,46.0,44.0,44.872,1/22/2024 19:04,CMM3,QC015,pass,PO000292,PART-035,LOT-00292,2024-01-22 13:04:00,149,M002,OP097,1,PLANT3,completed,True,0.5028779216004082,False,False
M0000293,PART-023,LOT-00293,bore_diameter,50,50.4,49.6,50.015,1/3/2024 6:12,CMM3,QC004,pass,PO000293,PART-023,LOT-00293,2024-01-03 04:12:00,463,M011,OP035,3,PLANT1,completed,True,0.661335814872126,False,False
M0000294,PART-028,LOT-00294,flatness,0,0.1,0.0,0.022,1/20/2024 10:55,CMM3,QC005,pass,PO000294,PART-028,LOT-00294,2024-01-19 04:55:00,400,M015,OP050,3,PLANT2,delayed,True,-0.8789685713485593,False,False
M0000295,PART-032,LOT-00295,bore_diameter,50,50.4,49.6,50.211,1/24/2024 13:25,CMM1,QC019,pass,PO000295,PART-032,LOT-00295,2024-01-23 15:25:00,208,M017,OP035,2,PLANT1,completed,True,0.6673746535035194,False,False
M0000296,PART-006,LOT-00296,length,20,20.2,19.8,19.776,1/22/2024 12:20,CMM3,QC012,fail,PO000296,PART-006,LOT-00296,2024-01-20 14:20:00,328,M006,OP070,2,PLANT2,completed,False,-0.27033990642740197,False,False
M0000297,PART-006,LOT-00297,length,20,20.2,19.8,19.917,1/17/2024 19:10,CMM1,QC019,pass,PO000297,PART-006,LOT-00297,2024-01-15 22:10:00,358,M010,OP040,3,PLANT2,completed,True,-0.26599563986094027,False,False
M0000298,PART-028,LOT-00298,parallelism,0,0.1,0.0,0.071,1/9/2024 7:01,CMM3,QC007,pass,PO000298,PART-028,LOT-00298,2024-01-08 14:01:00,373,M015,OP045,2,PLANT2,completed,True,-0.8774588616907109,False,False
M0000299,PART-023,LOT-00299,parallelism,0,0.1,0.0,-0.065,1/30/2024 7:34,CMM1,QC019,fail,PO000299,PART-023,LOT-00299,2024-01-28 23:34:00,242,M009,OP082,3,PLANT1,completed,False,-0.8816490762512696,False,False
M0000300,PART-041,LOT-00300,outer_diameter,100,100.5,99.5,99.975,1/21/2024 3:41,CMM2,QC011,pass,PO000300,PART-041,LOT-00300,2024-01-19 11:41:00,206,M017,OP096,1,PLANT3,completed,True,2.200623457853852,False,False
M0000301,PART-002,LOT-00301,outer_diameter,100,100.5,99.5,100.098,1/8/2024 0:57,CMM3,QC015,pass,PO000301,PART-002,LOT-00301,2024-01-07 11:57:00,454,M020,OP087,1,PLANT2,completed,True,2.2044131371990634,False,False
M0000302,PART-005,LOT-00302,outer_diameter,100,100.5,99.5,100.047,1/12/2024 3:46,CMM1,QC015,pass,PO000302,PART-005,LOT-00302,2024-01-11 17:46:00,418,M012,OP047,2,PLANT2,delayed,True,2.2028418067388538,False,False
M0000303,PART-003,LOT-00303,angle,45,46.0,44.0,44.792,1/29/2024 17:55,CMM2,QC004,pass,PO000303,PART-003,LOT-00303,2024-01-28 12:55:00,98,M015,OP048,1,PLANT2,completed,True,0.500413089505962,False,False
M0000304,PART-005,LOT-00304,thickness,5,5.05,4.95,4.997,1/27/2024 21:52,CMM3,QC015,pass,PO000304,PART-005,LOT-00304,2024-01-27 02:52:00,90,M017,OP047,3,PLANT2,completed,True,-0.7256868254751788,False,False
M0000305,PART-018,LOT-00305,width,10,10.1,9.9,9.984,1/12/2024 18:38,CMM2,QC005,pass,PO000305,PART-018,LOT-00305,2024-01-12 08:38:00,78,M001,OP095,1,PLANT1,completed,True,-0.5720353547876313,False,False
M0000306,PART-025,LOT-00306,angle,45,46.0,44.0,44.804,1/27/2024 22:29,CMM3,QC008,pass,PO000306,PART-025,LOT-00306,2024-01-26 13:29:00,80,M009,OP100,1,PLANT2,completed,True,0.5007828143201289,False,False
M0000307,PART-014,LOT-00307,outer_diameter,100,100.5,99.5,100.142,1/30/2024 13:19,CMM3,QC016,pass,PO000307,PART-014,LOT-00307,2024-01-28 20:19:00,166,M016,OP026,2,PLANT1,completed,True,2.2057687948510085,False,False
M0000308,PART-005,LOT-00308,parallelism,0,0.1,0.0,0.012,1/23/2024 6:45,CMM2,QC015,pass,PO000308,PART-005,LOT-00308,2024-01-21 13:45:00,108,M015,OP012,1,PLANT3,delayed,True,-0.879276675360365,False,False
M0000309,PART-021,LOT-00309,parallelism,0,0.1,0.0,-0.023,1/18/2024 19:28,CMM2,QC010,fail,PO000309,PART-021,LOT-00309,2024-01-16 19:28:00,383,M003,OP071,2,PLANT3,completed,False,-0.8803550394016852,False,False
M0000310,PART-020,LOT-00310,width,10,10.1,9.9,10.03,1/8/2024 16:02,CMM3,QC011,pass,PO000310,PART-020,LOT-00310,2024-01-08 04:02:00,384,M006,OP047,3,PLANT3,completed,True,-0.5706180763333247,False,False
M0000311,PART-013,LOT-00311,thickness,5,5.05,4.95,5.005,1/8/2024 12:41,CMM3,QC016,pass,PO000311,PART-013,LOT-00311,2024-01-07 07:41:00,141,M016,OP004,1,PLANT2,completed,True,-0.7254403422657342,False,False
M0000312,PART-024,LOT-00312,length,20,20.2,19.8,20.054,1/23/2024 6:31,CMM2,QC016,pass,PO000312,PART-024,LOT-00312,2024-01-22 06:31:00,431,M018,OP017,1,PLANT3,in_progress,True,-0.26177461489920106,False,False
M0000313,PART-005,LOT-00313,outer_diameter,100,100.5,99.5,100.105,1/16/2024 2:49,CMM3,QC010,pass,PO000313,PART-005,LOT-00313,2024-01-15 01:49:00,223,M016,OP068,3,PLANT2,completed,True,2.2046288100073275,False,False
M0000314,PART-037,LOT-00314,width,10,10.1,9.9,9.972,1/6/2024 3:33,CMM3,QC002,pass,PO000314,PART-037,LOT-00314,2024-01-04 08:33:00,84,M011,OP083,1,PLANT1,completed,True,-0.5724050796017983,False,False
M0000315,PART-044,LOT-00315,length,20,20.2,19.8,19.963,1/26/2024 1:05,CMM1,QC008,pass,PO000315,PART-044,LOT-00315,2024-01-24 13:05:00,196,M005,OP100,1,PLANT3,completed,True,-0.26457836140663366,False,False
M0000316,PART-012,LOT-00316,thickness,5,5.05,4.95,5.012,1/8/2024 13:56,CMM1,QC010,pass,PO000316,PART-012,LOT-00316,2024-01-06 20:56:00,241,M017,OP008,2,PLANT1,completed,True,-0.7252246694574701,False,False
M0000317,PART-020,LOT-00317,length,20,20.2,19.8,20.041,1/10/2024 0:50,CMM2,QC002,pass,PO000317,PART-020,LOT-00317,2024-01-08 11:50:00,102,M011,OP091,1,PLANT1,completed,True,-0.2621751501145485,False,False
M0000318,PART-034,LOT-00318,bore_diameter,50,50.4,49.6,49.997,1/15/2024 10:15,CMM2,QC001,pass,PO000318,PART-034,LOT-00318,2024-01-13 22:15:00,453,M003,OP033,3,PLANT1,completed,True,0.6607812276508755,False,False
M0000319,PART-036,LOT-00319,outer_diameter,100,100.5,99.5,100.02,1/14/2024 9:46,CMM2,QC008,pass,PO000319,PART-036,LOT-00319,2024-01-13 11:46:00,84,M010,OP079,1,PLANT3,completed,True,2.202009925906978,False,False
M0000320,PART-042,LOT-00320,parallelism,0,0.1,0.0,0.043,1/9/2024 10:11,CMM1,QC013,pass,PO000320,PART-042,LOT-00320,2024-01-08 16:11:00,323,M019,OP020,2,PLANT1,completed,True,-0.8783215529237671,False,False
M0000321,PART-047,LOT-00321,flatness,0,0.1,0.0,-0.02,1/30/2024 8:58,CMM1,QC005,fail,PO000321,PART-047,LOT-00321,2024-01-28 12:58:00,192,M019,OP006,1,PLANT1,completed,False,-0.8802626081981435,False,False
M0000322,PART-042,LOT-00322,angle,45,46.0,44.0,45.182,1/27/2024 14:59,CMM1,QC008,pass,PO000322,PART-042,LOT-00322,2024-01-27 05:59:00,155,M007,OP099,3,PLANT3,completed,True,0.5124291459663878,False,False
M0000323,PART-041,LOT-00323,flatness,0,0.1,0.0,-0.007,1/2/2024 23:04,CMM1,QC020,fail,PO000323,PART-041,LOT-00323,2024-01-02 09:04:00,274,M018,OP038,1,PLANT3,delayed,False,-0.8798620729827961,False,False
M0000324,PART-031,LOT-00324,outer_diameter,100,100.5,99.5,99.964,1/12/2024 20:28,CMM3,QC002,pass,PO000324,PART-031,LOT-00324,2024-01-12 03:28:00,432,M013,OP039,3,PLANT2,completed,True,2.2002845434408655,False,False
M0000325,PART-004,LOT-00325,outer_diameter,100,100.5,99.5,100.183,1/8/2024 13:39,CMM2,QC008,pass,PO000325,PART-004,LOT-00325,2024-01-08 04:39:00,245,M014,OP062,3,PLANT2,completed,True,2.207032021299413,False,False
M0000326,PART-039,LOT-00326,outer_diameter,100,100.5,99.5,100.138,1/7/2024 19:55,CMM2,QC006,pass,PO000326,PART-039,LOT-00326,2024-01-07 12:55:00,180,M011,OP094,1,PLANT2,delayed,True,2.2056455532462866,False,False
M0000327,PART-009,LOT-00327,length,20,20.2,19.8,20.054,1/18/2024 0:43,CMM2,QC016,pass,PO000327,PART-009,LOT-00327,2024-01-17 20:43:00,283,M018,OP014,2,PLANT2,completed,True,-0.26177461489920106,False,False
M0000328,PART-008,LOT-00328,angle,45,46.0,44.0,45.435,1/13/2024 4:09,CMM1,QC003,pass,PO000328,PART-008,LOT-00328,2024-01-13 04:09:00,250,M008,OP019,3,PLANT1,completed,True,0.5202241774650743,False,False
M0000329,PART-025,LOT-00329,thickness,5,5.05,4.95,5.0,1/30/2024 15:09,CMM1,QC007,pass,PO000329,PART-025,LOT-00329,2024-01-29 00:09:00,234,M008,OP021,3,PLANT2,delayed,True,-0.7255943942716371,False,False
M0000330,PART-047,LOT-00330,angle,45,46.0,44.0,45.227,1/17/2024 4:34,CMM2,QC015,pass,PO000330,PART-047,LOT-00330,2024-01-15 05:34:00,117,M006,OP064,3,PLANT3,completed,True,0.5138156140195137,False,False
M0000331,PART-020,LOT-00331,thickness,5,5.05,4.95,4.995,1/25/2024 3:15,CMM3,QC008,pass,PO000331,PART-020,LOT-00331,2024-01-23 15:15:00,31,M003,OP051,2,PLANT3,completed,True,-0.7257484462775399,False,False
M0000332,PART-016,LOT-00332,angle,45,46.0,44.0,45.108,1/12/2024 13:59,CMM2,QC016,pass,PO000332,PART-016,LOT-00332,2024-01-10 18:59:00,318,M012,OP007,2,PLANT1,completed,True,0.5101491762790248,False,False
M0000333,PART-039,LOT-00333,parallelism,0,0.1,0.0,-0.004,1/30/2024 23:37,CMM2,QC008,fail,PO000333,PART-039,LOT-00333,2024-01-30 18:37:00,364,M016,OP037,2,PLANT3,completed,False,-0.8797696417792543,False,False
M0000334,PART-007,LOT-00334,bore_diameter,50,50.4,49.6,50.013,1/21/2024 0:41,CMM2,QC006,pass,PO000334,PART-007,LOT-00334,2024-01-20 14:41:00,88,M009,OP094,2,PLANT2,completed,True,0.6612741940697647,False,False
M0000335,PART-024,LOT-00335,thickness,5,5.05,4.95,5.01,1/3/2024 16:25,CMM2,QC011,pass,PO000335,PART-024,LOT-00335,2024-01-03 01:25:00,225,M002,OP073,3,PLANT3,completed,True,-0.7252862902598314,False,False
M0000336,PART-036,LOT-00336,bore_diameter,50,50.4,49.6,50.525,1/14/2024 4:13,CMM3,QC002,fail,PO000336,PART-036,LOT-00336,2024-01-14 03:13:00,57,M013,OP065,3,PLANT2,completed,False,0.6770491194742212,False,False
M0000337,PART-018,LOT-00337,bore_diameter,50,50.4,49.6,49.891,1/30/2024 13:44,CMM2,QC003,pass,PO000337,PART-018,LOT-00337,2024-01-29 08:44:00,368,M020,OP016,1,PLANT1,delayed,True,0.6575153251257342,False,False
M0000338,PART-026,LOT-00338,thickness,5,5.05,4.95,5.035,1/19/2024 3:37,CMM3,QC016,pass,PO000338,PART-026,LOT-00338,2024-01-17 23:37:00,426,M011,OP072,3,PLANT2,completed,True,-0.7245160302303167,False,False
M0000339,PART-013,LOT-00339,width,10,10.1,9.9,9.966,1/30/2024 7:03,CMM2,QC011,pass,PO000339,PART-013,LOT-00339,2024-01-28 10:03:00,280,M013,OP065,1,PLANT1,completed,True,-0.5725899420088818,False,False
M0000340,PART-009,LOT-00340,thickness,5,5.05,4.95,4.98,1/16/2024 6:46,CMM3,QC010,pass,PO000340,PART-009,LOT-00340,2024-01-16 03:46:00,431,M016,OP067,3,PLANT2,completed,True,-0.7262106022952486,False,False
M0000341,PART-033,LOT-00341,length,20,20.2,19.8,20.077,1/7/2024 15:40,CMM2,QC020,pass,PO000341,PART-033,LOT-00341,2024-01-07 08:40:00,187,M020,OP041,1,PLANT1,completed,True,-0.26106597567204765,False,False
M0000342,PART-040,LOT-00342,parallelism,0,0.1,0.0,0.026,1/16/2024 12:50,CMM3,QC002,pass,PO000342,PART-040,LOT-00342,2024-01-14 14:50:00,323,M011,OP065,2,PLANT3,completed,True,-0.8788453297438369,False,False
M0000343,PART-046,LOT-00343,flatness,0,0.1,0.0,0.021,1/27/2024 13:51,CMM2,QC019,pass,PO000343,PART-046,LOT-00343,2024-01-26 14:51:00,173,M016,OP003,2,PLANT2,completed,True,-0.8789993817497398,False,False
M0000344,PART-008,LOT-00344,width,10,10.1,9.9,10.021,1/20/2024 17:58,CMM1,QC019,pass,PO000344,PART-008,LOT-00344,2024-01-19 22:58:00,318,M010,OP093,3,PLANT3,completed,True,-0.57089536994395,False,False
M0000345,PART-039,LOT-00345,flatness,0,0.1,0.0,0.0,1/23/2024 7:22,CMM2,QC007,pass,PO000345,PART-039,LOT-00345,2024-01-22 14:22:00,155,M019,OP074,2,PLANT1,completed,True,-0.879646400174532,False,False
M0000346,PART-038,LOT-00346,length,20,20.2,19.8,19.94,1/24/2024 16:46,CMM2,QC006,pass,PO000346,PART-038,LOT-00346,2024-01-22 20:46:00,107,M017,OP081,2,PLANT3,completed,True,-0.26528700063378696,False,False
M0000347,PART-025,LOT-00347,parallelism,0,0.1,0.0,0.003,1/8/2024 7:24,CMM2,QC015,pass,PO000347,PART-025,LOT-00347,2024-01-07 17:24:00,440,M008,OP005,2,PLANT3,delayed,True,-0.8795539689709903,False,False
M0000348,PART-008,LOT-00348,width,10,10.1,9.9,9.977,1/11/2024 0:23,CMM1,QC008,pass,PO000348,PART-008,LOT-00348,2024-01-09 16:23:00,29,M015,OP041,2,PLANT2,completed,True,-0.5722510275958954,False,False
M0000349,PART-045,LOT-00349,width,10,10.1,9.9,10.121,1/10/2024 21:42,CMM3,QC007,fail,PO000349,PART-045,LOT-00349,2024-01-10 06:42:00,230,M017,OP100,1,PLANT3,delayed,False,-0.567814329825892,False,False
M0000350,PART-048,LOT-00350,bore_diameter,50,50.4,49.6,50.13,1/4/2024 10:01,CMM2,QC010,pass,PO000350,PART-048,LOT-00350,2024-01-03 20:01:00,381,M005,OP067,2,PLANT1,completed,True,0.6648790110078927,False,False
M0000351,PART-043,LOT-00351,outer_diameter,100,100.5,99.5,99.975,1/23/2024 3:30,CMM2,QC016,pass,PO000351,PART-043,LOT-00351,2024-01-22 18:30:00,289,M013,OP041,2,PLANT1,completed,True,2.200623457853852,False,False
M0000352,PART-035,LOT-00352,thickness,5,5.05,4.95,4.934,1/18/2024 10:54,CMM2,QC006,fail,PO000352,PART-035,LOT-00352,2024-01-16 13:54:00,299,M012,OP087,1,PLANT3,completed,False,-0.7276278807495552,False,False
M0000353,PART-045,LOT-00353,bore_diameter,50,50.4,49.6,49.89,1/13/2024 22:45,CMM1,QC011,pass,PO000353,PART-045,LOT-00353,2024-01-13 00:45:00,332,M016,OP025,3,PLANT1,completed,True,0.6574845147245536,False,False
M0000354,PART-020,LOT-00354,outer_diameter,100,100.5,99.5,99.946,1/11/2024 13:36,CMM1,QC005,pass,PO000354,PART-020,LOT-00354,2024-01-11 05:36:00,172,M010,OP091,3,PLANT1,completed,True,2.199729956219615,False,False
M0000355,PART-032,LOT-00355,angle,45,46.0,44.0,45.138,1/15/2024 11:17,CMM2,QC003,pass,PO000355,PART-032,LOT-00355,2024-01-15 10:17:00,265,M012,OP072,1,PLANT3,completed,True,0.5110734883144422,False,False
M0000356,PART-008,LOT-00356,angle,45,46.0,44.0,44.812,1/27/2024 22:23,CMM3,QC016,pass,PO000356,PART-008,LOT-00356,2024-01-27 02:23:00,366,M018,OP049,3,PLANT2,in_progress,True,0.5010292975295735,False,False
M0000357,PART-050,LOT-00357,bore_diameter,50,50.4,49.6,49.89,1/8/2024 8:59,CMM3,QC002,pass,PO000357,PART-050,LOT-00357,2024-01-07 15:59:00,168,M002,OP037,2,PLANT3,completed,True,0.6574845147245536,False,False
M0000358,PART-029,LOT-00358,thickness,5,5.05,4.95,5.004,2/1/2024 13:29,CMM3,QC010,pass,PO000358,PART-029,LOT-00358,2024-01-30 20:29:00,151,M016,OP028,2,PLANT1,in_progress,True,-0.7254711526669148,False,False
M0000359,PART-018,LOT-00359,angle,45,46.0,44.0,45.082,1/26/2024 17:52,CMM1,QC019,pass,PO000359,PART-018,LOT-00359,2024-01-26 13:52:00,376,M009,OP018,1,PLANT1,completed,True,0.5093481058483299,False,False
M0000360,PART-038,LOT-00360,length,20,20.2,19.8,19.966,1/12/2024 20:21,CMM1,QC005,pass,PO000360,PART-038,LOT-00360,2024-01-11 21:21:00,144,M002,OP086,2,PLANT3,completed,True,-0.2644859302030919,False,False
M0000361,PART-015,LOT-00361,angle,45,46.0,44.0,44.843,1/3/2024 11:20,CMM2,QC017,pass,PO000361,PART-015,LOT-00361,2024-01-03 09:20:00,71,M014,OP043,1,PLANT3,completed,True,0.5019844199661716,False,False
M0000362,PART-044,LOT-00362,outer_diameter,100,100.5,99.5,100.039,1/7/2024 21:09,CMM3,QC012,pass,PO000362,PART-044,LOT-00362,2024-01-07 06:09:00,22,M018,OP021,1,PLANT2,completed,True,2.202595323529409,False,False
M0000363,PART-031,LOT-00363,bore_diameter,50,50.4,49.6,49.807,1/24/2024 16:30,CMM1,QC010,pass,PO000363,PART-031,LOT-00363,2024-01-22 17:30:00,353,M007,OP097,2,PLANT2,completed,True,0.6549272514265656,False,False
M0000364,PART-042,LOT-00364,thickness,5,5.05,4.95,4.977,1/3/2024 20:37,CMM3,QC016,pass,PO000364,PART-042,LOT-00364,2024-01-03 16:37:00,484,M003,OP084,2,PLANT3,completed,True,-0.7263030334987903,False,False
M0000365,PART-048,LOT-00365,outer_diameter,100,100.5,99.5,99.88,1/3/2024 23:44,CMM2,QC012,pass,PO000365,PART-048,LOT-00365,2024-01-02 16:44:00,487,M006,OP054,2,PLANT1,delayed,True,2.197696469741697,False,False
M0000366,PART-003,LOT-00366,parallelism,0,0.1,0.0,-0.007,1/20/2024 2:37,CMM2,QC008,fail,PO000366,PART-003,LOT-00366,2024-01-19 01:37:00,423,M016,OP024,3,PLANT3,delayed,False,-0.8798620729827961,False,False
M0000367,PART-019,LOT-00367,length,20,20.2,19.8,20.021,1/4/2024 8:55,CMM3,QC005,pass,PO000367,PART-019,LOT-00367,2024-01-02 16:55:00,24,M010,OP073,2,PLANT3,completed,True,-0.26279135813816007,False,False
M0000368,PART-022,LOT-00368,thickness,5,5.05,4.95,5.025,1/13/2024 23:49,CMM2,QC004,pass,PO000368,PART-022,LOT-00368,2024-01-13 22:49:00,252,M018,OP068,3,PLANT2,in_progress,True,-0.7248241342421227,False,False
M0000369,PART-009,LOT-00369,flatness,0,0.1,0.0,0.029,1/24/2024 2:44,CMM3,QC018,pass,PO000369,PART-009,LOT-00369,2024-01-23 22:44:00,259,M009,OP025,3,PLANT1,completed,True,-0.8787528985402951,False,False
M0000370,PART-047,LOT-00370,angle,45,46.0,44.0,44.947,1/23/2024 18:15,CMM2,QC008,pass,PO000370,PART-047,LOT-00370,2024-01-21 21:15:00,351,M009,OP092,2,PLANT1,completed,True,0.5051887016889518,False,False
M0000371,PART-022,LOT-00371,angle,45,46.0,44.0,44.994,1/14/2024 10:14,CMM2,QC014,pass,PO000371,PART-022,LOT-00371,2024-01-14 10:14:00,310,M007,OP023,1,PLANT3,in_progress,True,0.5066367905444389,False,False
M0000372,PART-026,LOT-00372,outer_diameter,100,100.5,99.5,99.833,1/21/2024 5:09,CMM1,QC002,pass,PO000372,PART-026,LOT-00372,2024-01-20 11:09:00,283,M011,OP012,1,PLANT2,completed,True,2.19624838088621,False,False
M0000373,PART-012,LOT-00373,angle,45,46.0,44.0,44.994,1/9/2024 3:35,CMM2,QC017,pass,PO000373,PART-012,LOT-00373,2024-01-07 09:35:00,264,M011,OP032,1,PLANT1,completed,True,0.5066367905444389,False,False
M0000374,PART-016,LOT-00374,angle,45,46.0,44.0,44.904,1/22/2024 9:57,CMM3,QC015,pass,PO000374,PART-016,LOT-00374,2024-01-21 07:57:00,405,M009,OP043,1,PLANT2,completed,True,0.5038638544381869,False,False
M0000375,PART-037,LOT-00375,parallelism,0,0.1,0.0,0.011,1/2/2024 7:29,CMM1,QC007,pass,PO000375,PART-037,LOT-00375,2024-01-01 12:29:00,153,M012,OP089,1,PLANT1,completed,True,-0.8793074857615456,False,False
M0000376,PART-008,LOT-00376,flatness,0,0.1,0.0,-0.012,1/24/2024 4:20,CMM3,QC002,fail,PO000376,PART-008,LOT-00376,2024-01-22 04:20:00,177,M006,OP052,3,PLANT3,completed,False,-0.880016124988699,False,False
M0000377,PART-046,LOT-00377,outer_diameter,100,100.5,99.5,99.306,1/16/2024 5:40,CMM3,QC004,fail,PO000377,PART-046,LOT-00377,2024-01-15 03:40:00,373,M004,OP082,3,PLANT2,completed,False,2.1800112994640446,False,True
M0000378,PART-015,LOT-00378,bore_diameter,50,50.4,49.6,49.89,1/12/2024 13:20,CMM1,QC016,pass,PO000378,PART-015,LOT-00378,2024-01-10 23:20:00,88,M016,OP020,3,PLANT2,completed,True,0.6574845147245536,False,False
M0000379,PART-039,LOT-00379,outer_diameter,100,100.5,99.5,100.087,1/18/2024 13:05,CMM1,QC009,pass,PO000379,PART-039,LOT-00379,2024-01-18 00:05:00,232,M018,OP061,3,PLANT3,in_progress,True,2.204074222786077,False,False
M0000380,PART-014,LOT-00380,flatness,0,0.1,0.0,0.051,1/13/2024 6:17,CMM1,QC018,pass,PO000380,PART-014,LOT-00380,2024-01-12 06:17:00,368,M020,OP011,1,PLANT3,completed,True,-0.8780750697143225,False,False
M0000381,PART-046,LOT-00381,outer_diameter,100,100.5,99.5,99.982,1/18/2024 19:09,CMM2,QC018,pass,PO000381,PART-046,LOT-00381,2024-01-17 11:09:00,59,M019,OP015,1,PLANT1,in_progress,True,2.200839130662116,False,False
M0000382,PART-033,LOT-00382,angle,45,46.0,44.0,45.134,1/11/2024 23:48,CMM2,QC014,pass,PO000382,PART-033,LOT-00382,2024-01-10 04:48:00,313,M018,OP020,3,PLANT1,completed,True,0.51095024670972,False,False
M0000383,PART-034,LOT-00383,bore_diameter,50,50.4,49.6,50.092,1/22/2024 18:36,CMM1,QC019,pass,PO000383,PART-034,LOT-00383,2024-01-21 02:36:00,79,M007,OP092,3,PLANT3,completed,True,0.6637082157630305,False,False
M0000384,PART-033,LOT-00384,flatness,0,0.1,0.0,-0.013,1/22/2024 7:35,CMM3,QC018,fail,PO000384,PART-033,LOT-00384,2024-01-21 06:35:00,434,M002,OP059,1,PLANT1,completed,False,-0.8800469353898795,False,False
M0000385,PART-030,LOT-00385,length,20,20.2,19.8,20.015,1/27/2024 2:56,CMM3,QC002,pass,PO000385,PART-030,LOT-00385,2024-01-26 15:56:00,49,M018,OP060,2,PLANT3,in_progress,True,-0.26297622054524356,False,False
M0000386,PART-047,LOT-00386,bore_diameter,50,50.4,49.6,50.002,1/2/2024 8:46,CMM3,QC016,pass,PO000386,PART-047,LOT-00386,2024-01-01 23:46:00,222,M009,OP001,3,PLANT3,completed,True,0.6609352796567786,False,False
M0000387,PART-005,LOT-00387,length,20,20.2,19.8,20.007,1/4/2024 23:28,CMM3,QC018,pass,PO000387,PART-005,LOT-00387,2024-01-03 01:28:00,236,M012,OP090,3,PLANT1,completed,True,-0.26322270375468815,False,False
M0000388,PART-004,LOT-00388,outer_diameter,100,100.5,99.5,99.871,1/4/2024 21:23,CMM2,QC005,pass,PO000388,PART-004,LOT-00388,2024-01-04 03:23:00,498,M016,OP005,3,PLANT2,completed,True,2.197419176131072,False,False
M0000389,PART-050,LOT-00389,width,10,10.1,9.9,10.001,1/8/2024 1:55,CMM2,QC010,pass,PO000389,PART-050,LOT-00389,2024-01-07 03:55:00,412,M014,OP048,3,PLANT2,completed,True,-0.5715115779675616,False,False
M0000390,PART-025,LOT-00390,bore_diameter,50,50.4,49.6,50.066,1/18/2024 16:18,CMM3,QC001,pass,PO000390,PART-025,LOT-00390,2024-01-18 02:18:00,61,M018,OP018,3,PLANT3,in_progress,True,0.6629071453323356,False,False
M0000391,PART-008,LOT-00391,width,10,10.1,9.9,10.128,1/10/2024 11:56,CMM3,QC019,fail,PO000391,PART-008,LOT-00391,2024-01-09 02:56:00,295,M013,OP068,3,PLANT1,completed,False,-0.567598657017628,False,False
M0000392,PART-015,LOT-00392,angle,45,46.0,44.0,45.484,1/1/2024 19:47,CMM2,QC010,pass,PO000392,PART-015,LOT-00392,2024-01-01 03:47:00,407,M001,OP039,3,PLANT2,completed,True,0.5217338871229227,False,False
M0000393,PART-035,LOT-00393,width,10,10.1,9.9,10.032,1/20/2024 12:15,CMM2,QC013,pass,PO000393,PART-035,LOT-00393,2024-01-20 07:15:00,292,M013,OP030,1,PLANT1,completed,True,-0.5705564555309636,False,False
M0000394,PART-010,LOT-00394,parallelism,0,0.1,0.0,0.072,1/13/2024 15:04,CMM2,QC013,pass,PO000394,PART-010,LOT-00394,2024-01-13 13:04:00,116,M004,OP005,1,PLANT3,completed,True,-0.8774280512895303,False,False
M0000395,PART-050,LOT-00395,flatness,0,0.1,0.0,-0.026,1/1/2024 21:05,CMM3,QC011,fail,PO000395,PART-050,LOT-00395,2024-01-01 17:05:00,143,M007,OP009,2,PLANT1,completed,False,-0.880447470605227,False,False
M0000396,PART-029,LOT-00396,parallelism,0,0.1,0.0,0.029,1/28/2024 9:56,CMM2,QC010,pass,PO000396,PART-029,LOT-00396,2024-01-28 04:56:00,364,M002,OP032,3,PLANT3,completed,True,-0.8787528985402951,False,False
M0000397,PART-029,LOT-00397,angle,45,46.0,44.0,45.061,1/12/2024 13:57,CMM3,QC020,pass,PO000397,PART-029,LOT-00397,2024-01-11 15:57:00,296,M007,OP097,2,PLANT1,completed,True,0.5087010874235377,False,False
M0000398,PART-019,LOT-00398,angle,45,46.0,44.0,45.73,1/12/2024 4:46,CMM2,QC008,pass,PO000398,PART-019,LOT-00398,2024-01-11 15:46:00,437,M019,OP041,2,PLANT3,completed,True,0.5293132458133449,False,False
M0000399,PART-044,LOT-00399,outer_diameter,100,100.5,99.5,99.865,1/17/2024 6:15,CMM3,QC015,pass,PO000399,PART-044,LOT-00399,2024-01-15 14:15:00,141,M010,OP019,2,PLANT3,completed,True,2.1972343137239885,False,False
M0000400,PART-027,LOT-00400,width,10,10.1,9.9,9.972,1/15/2024 1:13,CMM1,QC002,pass,PO000400,PART-027,LOT-00400,2024-01-14 16:13:00,160,M002,OP072,2,PLANT3,in_progress,True,-0.5724050796017983,False,False
M0000401,PART-012,LOT-00401,length,20,20.2,19.8,19.96,1/30/2024 9:45,CMM2,QC011,pass,PO000401,PART-012,LOT-00401,2024-01-29 11:45:00,367,M014,OP072,1,PLANT2,completed,True,-0.2646707926101754,False,False
M0000402,PART-023,LOT-00402,width,10,10.1,9.9,9.929,1/31/2024 12:40,CMM3,QC016,pass,PO000402,PART-023,LOT-00402,2024-01-30 06:40:00,363,M013,OP068,1,PLANT2,completed,True,-0.5737299268525632,False,False
M0000403,PART-027,LOT-00403,parallelism,0,0.1,0.0,-0.018,1/7/2024 19:59,CMM3,QC007,fail,PO000403,PART-027,LOT-00403,2024-01-07 18:59:00,173,M013,OP024,2,PLANT3,completed,False,-0.8802009873957825,False,False
M0000404,PART-015,LOT-00404,outer_diameter,100,100.5,99.5,99.873,1/16/2024 12:29,CMM3,QC016,pass,PO000404,PART-015,LOT-00404,2024-01-14 16:29:00,459,M005,OP060,2,PLANT1,completed,True,2.197480796933433,False,False
M0000405,PART-027,LOT-00405,outer_diameter,100,100.5,99.5,100.025,1/26/2024 18:42,CMM2,QC004,pass,PO000405,PART-027,LOT-00405,2024-01-26 08:42:00,291,M005,OP050,1,PLANT1,completed,True,2.2021639779128814,False,False
M0000406,PART-022,LOT-00406,angle,45,46.0,44.0,45.114,1/31/2024 16:22,CMM3,QC005,pass,PO000406,PART-022,LOT-00406,2024-01-30 10:22:00,60,M015,OP048,1,PLANT1,completed,True,0.5103340386861083,False,False
M0000407,PART-013,LOT-00407,bore_diameter,50,50.4,49.6,50.25,1/3/2024 17:17,CMM2,QC002,pass,PO000407,PART-013,LOT-00407,2024-01-03 08:17:00,157,M013,OP087,1,PLANT3,completed,True,0.6685762591495621,False,False
M0000408,PART-005,LOT-00408,length,20,20.2,19.8,20.063,1/10/2024 7:31,CMM2,QC011,pass,PO000408,PART-005,LOT-00408,2024-01-09 13:31:00,431,M019,OP093,1,PLANT3,completed,True,-0.26149732128857583,False,False
M0000409,PART-031,LOT-00409,bore_diameter,50,50.4,49.6,49.923,1/11/2024 9:09,CMM2,QC019,pass,PO000409,PART-031,LOT-00409,2024-01-10 12:09:00,465,M011,OP039,1,PLANT1,completed,True,0.6585012579635128,False,False
M0000410,PART-013,LOT-00410,bore_diameter,50,50.4,49.6,49.88,1/8/2024 7:08,CMM3,QC002,pass,PO000410,PART-013,LOT-00410,2024-01-06 08:08:00,402,M016,OP032,1,PLANT3,completed,True,0.6571764107127479,False,False
M0000411,PART-014,LOT-00411,width,10,10.1,9.9,10.016,1/20/2024 8:13,CMM2,QC015,pass,PO000411,PART-014,LOT-00411,2024-01-19 01:13:00,488,M008,OP071,3,PLANT2,completed,True,-0.5710494219498529,False,False
M0000412,PART-025,LOT-00412,width,10,10.1,9.9,9.956,1/23/2024 11:16,CMM1,QC010,pass,PO000412,PART-025,LOT-00412,2024-01-22 05:16:00,293,M012,OP040,3,PLANT2,completed,True,-0.5728980460206876,False,False
M0000413,PART-032,LOT-00413,flatness,0,0.1,0.0,0.061,1/22/2024 18:00,CMM1,QC007,pass,PO000413,PART-032,LOT-00413,2024-01-22 05:00:00,70,M016,OP098,3,PLANT2,delayed,True,-0.8777669657025167,False,False
M0000414,PART-024,LOT-00414,thickness,5,5.05,4.95,5.02,1/15/2024 19:47,CMM3,QC002,pass,PO000414,PART-024,LOT-00414,2024-01-15 05:47:00,231,M002,OP073,3,PLANT1,completed,True,-0.7249781862480255,False,False
M0000415,PART-002,LOT-00415,bore_diameter,50,50.4,49.6,50.452,1/13/2024 6:50,CMM3,QC010,fail,PO000415,PART-002,LOT-00415,2024-01-12 20:50:00,303,M019,OP075,2,PLANT3,completed,False,0.674799960188039,False,False
M0000416,PART-010,LOT-00416,width,10,10.1,9.9,9.984,1/11/2024 5:17,CMM3,QC009,pass,PO000416,PART-010,LOT-00416,2024-01-09 22:17:00,188,M008,OP049,3,PLANT3,in_progress,True,-0.5720353547876313,False,False
M0000417,PART-032,LOT-00417,outer_diameter,100,100.5,99.5,99.714,1/27/2024 13:26,CMM3,QC014,pass,PO000417,PART-032,LOT-00417,2024-01-26 01:26:00,355,M011,OP033,3,PLANT2,delayed,True,2.192581943145721,False,True
M0000418,PART-042,LOT-00418,angle,45,46.0,44.0,45.451,1/24/2024 9:51,CMM2,QC005,pass,PO000418,PART-042,LOT-00418,2024-01-23 07:51:00,255,M006,OP094,1,PLANT2,completed,True,0.5207171438839635,False,False
M0000419,PART-047,LOT-00419,parallelism,0,0.1,0.0,-0.004,1/26/2024 18:58,CMM1,QC017,fail,PO000419,PART-047,LOT-00419,2024-01-25 20:58:00,270,M006,OP070,2,PLANT3,delayed,False,-0.8797696417792543,False,False
M0000420,PART-034,LOT-00420,flatness,0,0.1,0.0,0.041,1/3/2024 9:56,CMM1,QC015,pass,PO000420,PART-034,LOT-00420,2024-01-02 12:56:00,449,M003,OP086,1,PLANT1,completed,True,-0.8783831737261283,False,False
M0000421,PART-027,LOT-00421,angle,45,46.0,44.0,44.469,1/7/2024 9:10,CMM1,QC006,pass,PO000421,PART-027,LOT-00421,2024-01-07 06:10:00,451,M008,OP009,1,PLANT3,completed,True,0.490461329924635,False,False
M0000422,PART-014,LOT-00422,length,20,20.2,19.8,19.96,1/24/2024 8:23,CMM1,QC010,pass,PO000422,PART-014,LOT-00422,2024-01-24 00:23:00,253,M012,OP008,3,PLANT3,completed,True,-0.2646707926101754,False,False
M0000423,PART-040,LOT-00423,bore_diameter,50,50.4,49.6,50.001,1/24/2024 22:47,CMM2,QC015,pass,PO000423,PART-040,LOT-00423,2024-01-22 23:47:00,357,M016,OP003,3,PLANT1,completed,True,0.6609044692555979,False,False
M0000424,PART-027,LOT-00424,outer_diameter,100,100.5,99.5,100.008,1/1/2024 17:56,CMM3,QC012,pass,PO000424,PART-027,LOT-00424,2024-01-01 12:56:00,28,M017,OP093,1,PLANT2,completed,True,2.201640201092811,False,False
M0000425,PART-019,LOT-00425,bore_diameter,50,50.4,49.6,49.94,1/2/2024 0:43,CMM3,QC006,pass,PO000425,PART-019,LOT-00425,2024-01-01 18:43:00,277,M014,OP023,2,PLANT1,delayed,True,0.6590250347835825,False,False
M0000426,PART-034,LOT-00426,bore_diameter,50,50.4,49.6,50.083,1/8/2024 20:38,CMM2,QC014,pass,PO000426,PART-034,LOT-00426,2024-01-07 18:38:00,143,M007,OP080,2,PLANT3,completed,True,0.6634309221524053,False,False
M0000427,PART-023,LOT-00427,bore_diameter,50,50.4,49.6,49.858,1/13/2024 10:59,CMM1,QC007,pass,PO000427,PART-023,LOT-00427,2024-01-13 03:59:00,427,M013,OP011,3,PLANT2,delayed,True,0.656498581886775,False,False
M0000428,PART-030,LOT-00428,length,20,20.2,19.8,19.991,1/28/2024 4:07,CMM2,QC009,pass,PO000428,PART-030,LOT-00428,2024-01-26 17:07:00,144,M008,OP039,2,PLANT3,in_progress,True,-0.2637156701735775,False,False
M0000429,PART-006,LOT-00429,parallelism,0,0.1,0.0,0.004,1/30/2024 20:03,CMM3,QC018,pass,PO000429,PART-006,LOT-00429,2024-01-30 18:03:00,459,M002,OP012,2,PLANT2,completed,True,-0.8795231585698097,False,False
M0000430,PART-036,LOT-00430,flatness,0,0.1,0.0,0.017,1/23/2024 17:55,CMM1,QC011,pass,PO000430,PART-036,LOT-00430,2024-01-22 15:55:00,48,M001,OP090,2,PLANT1,completed,True,-0.8791226233544621,False,False
M0000431,PART-028,LOT-00431,length,20,20.2,19.8,20.047,1/31/2024 23:24,CMM2,QC018,pass,PO000431,PART-028,LOT-00431,2024-01-30 08:24:00,421,M011,OP073,1,PLANT1,in_progress,True,-0.261990287707465,False,False
M0000432,PART-003,LOT-00432,thickness,5,5.05,4.95,4.981,1/11/2024 19:57,CMM1,QC005,pass,PO000432,PART-003,LOT-00432,2024-01-11 10:57:00,128,M019,OP061,1,PLANT2,completed,True,-0.726179791894068,False,False
M0000433,PART-005,LOT-00433,length,20,20.2,19.8,19.898,1/14/2024 10:14,CMM3,QC018,pass,PO000433,PART-005,LOT-00433,2024-01-13 18:14:00,480,M018,OP073,2,PLANT3,completed,True,-0.2665810374833713,False,False
M0000434,PART-021,LOT-00434,length,20,20.2,19.8,20.085,1/3/2024 3:06,CMM2,QC007,pass,PO000434,PART-021,LOT-00434,2024-01-01 17:06:00,126,M019,OP019,2,PLANT3,in_progress,True,-0.260819492462603,False,False
M0000435,PART-005,LOT-00435,outer_diameter,100,100.5,99.5,100.055,1/15/2024 19:53,CMM1,QC015,pass,PO000435,PART-005,LOT-00435,2024-01-14 14:53:00,103,M019,OP031,2,PLANT3,in_progress,True,2.203088289948299,False,False
M0000436,PART-025,LOT-00436,outer_diameter,100,100.5,99.5,99.875,1/25/2024 16:26,CMM1,QC003,pass,PO000436,PART-025,LOT-00436,2024-01-25 14:26:00,189,M013,OP097,2,PLANT3,completed,True,2.1975424177357943,False,False
M0000437,PART-045,LOT-00437,outer_diameter,100,100.5,99.5,100.259,1/4/2024 15:39,CMM3,QC005,pass,PO000437,PART-045,LOT-00437,2024-01-04 13:39:00,276,M012,OP007,1,PLANT1,completed,True,2.2093736117891365,False,False
M0000438,PART-005,LOT-00438,flatness,0,0.1,0.0,0.004,1/18/2024 4:01,CMM3,QC004,pass,PO000438,PART-005,LOT-00438,2024-01-16 12:01:00,329,M020,OP077,1,PLANT2,delayed,True,-0.8795231585698097,False,False
M0000439,PART-021,LOT-00439,thickness,5,5.05,4.95,5.02,1/3/2024 22:21,CMM1,QC019,pass,PO000439,PART-021,LOT-00439,2024-01-02 08:21:00,344,M009,OP058,1,PLANT2,completed,True,-0.7249781862480255,False,False
M0000440,PART-036,LOT-00440,flatness,0,0.1,0.0,0.121,1/18/2024 7:03,CMM3,QC019,fail,PO000440,PART-036,LOT-00440,2024-01-18 02:03:00,241,M006,OP088,3,PLANT3,completed,False,-0.8759183416316819,False,False
M0000441,PART-006,LOT-00441,outer_diameter,100,100.5,99.5,100.011,1/30/2024 16:41,CMM3,QC005,pass,PO000441,PART-006,LOT-00441,2024-01-29 03:41:00,171,M008,OP092,3,PLANT1,completed,True,2.201732632296353,False,False
M0000442,PART-010,LOT-00442,angle,45,46.0,44.0,45.687,1/19/2024 7:03,CMM3,QC020,pass,PO000442,PART-010,LOT-00442,2024-01-18 07:03:00,384,M005,OP095,1,PLANT2,completed,True,0.5279883985625801,False,False
M0000443,PART-007,LOT-00443,length,20,20.2,19.8,20.117,1/7/2024 1:57,CMM2,QC014,pass,PO000443,PART-007,LOT-00443,2024-01-05 03:57:00,22,M010,OP057,3,PLANT2,completed,True,-0.2598335596248245,False,False
M0000444,PART-007,LOT-00444,width,10,10.1,9.9,9.992,1/7/2024 2:43,CMM1,QC009,pass,PO000444,PART-007,LOT-00444,2024-01-07 00:43:00,64,M006,OP056,3,PLANT2,completed,True,-0.5717888715781867,False,False
M0000445,PART-033,LOT-00445,outer_diameter,100,100.5,99.5,100.162,1/20/2024 1:41,CMM1,QC017,pass,PO000445,PART-033,LOT-00445,2024-01-19 13:41:00,72,M001,OP012,1,PLANT2,completed,True,2.2063850028746206,False,False
M0000446,PART-039,LOT-00446,outer_diameter,100,100.5,99.5,100.108,1/29/2024 16:13,CMM3,QC004,pass,PO000446,PART-039,LOT-00446,2024-01-28 05:13:00,421,M011,OP050,3,PLANT1,completed,True,2.204721241210869,False,False
M0000447,PART-025,LOT-00447,thickness,5,5.05,4.95,4.926,1/6/2024 16:30,CMM3,QC008,fail,PO000447,PART-025,LOT-00447,2024-01-04 20:30:00,391,M018,OP032,2,PLANT3,completed,False,-0.7278743639589998,False,False
M0000448,PART-044,LOT-00448,length,20,20.2,19.8,20.091,1/18/2024 14:51,CMM2,QC019,pass,PO000448,PART-044,LOT-00448,2024-01-18 07:51:00,106,M005,OP035,1,PLANT2,completed,True,-0.26063463005551957,False,False
M0000449,PART-010,LOT-00449,bore_diameter,50,50.4,49.6,49.871,1/5/2024 1:06,CMM1,QC017,pass,PO000449,PART-010,LOT-00449,2024-01-03 21:06:00,105,M014,OP036,2,PLANT2,completed,True,0.6568991171021227,False,False
M0000450,PART-005,LOT-00450,angle,45,46.0,44.0,45.229,1/18/2024 22:26,CMM3,QC009,pass,PO000450,PART-005,LOT-00450,2024-01-17 10:26:00,148,M008,OP093,1,PLANT3,completed,True,0.513877234821875,False,False
M0000451,PART-040,LOT-00451,bore_diameter,50,50.4,49.6,50.141,1/10/2024 21:35,CMM2,QC004,pass,PO000451,PART-040,LOT-00451,2024-01-09 21:35:00,254,M004,OP018,2,PLANT2,completed,True,0.6652179254208789,False,False
M0000452,PART-026,LOT-00452,thickness,5,5.05,4.95,4.971,1/17/2024 10:52,CMM2,QC017,pass,PO000452,PART-026,LOT-00452,2024-01-16 02:52:00,450,M020,OP049,3,PLANT2,completed,True,-0.7264878959058738,False,False
M0000453,PART-028,LOT-00453,width,10,10.1,9.9,9.961,1/31/2024 3:06,CMM1,QC009,pass,PO000453,PART-028,LOT-00453,2024-01-30 15:06:00,324,M005,OP039,2,PLANT2,completed,True,-0.5727439940147847,False,False
M0000454,PART-045,LOT-00454,angle,45,46.0,44.0,44.32,1/11/2024 3:23,CMM2,QC011,pass,PO000454,PART-045,LOT-00454,2024-01-10 03:23:00,265,M011,OP023,3,PLANT2,delayed,True,0.4858705801487287,False,False
M0000455,PART-019,LOT-00455,parallelism,0,0.1,0.0,-0.009,1/31/2024 19:17,CMM1,QC015,fail,PO000455,PART-019,LOT-00455,2024-01-29 19:17:00,271,M019,OP032,2,PLANT2,completed,False,-0.8799236937851572,False,False
M0000456,PART-026,LOT-00456,angle,45,46.0,44.0,45.239,1/18/2024 20:41,CMM3,QC009,pass,PO000456,PART-026,LOT-00456,2024-01-17 14:41:00,78,M019,OP026,2,PLANT3,delayed,True,0.5141853388336807,False,False
M0000457,PART-012,LOT-00457,bore_diameter,50,50.4,49.6,50.2,1/26/2024 17:51,CMM1,QC008,pass,PO000457,PART-012,LOT-00457,2024-01-26 00:51:00,33,M015,OP091,3,PLANT1,completed,True,0.6670357390905332,False,False
M0000458,PART-019,LOT-00458,width,10,10.1,9.9,10.002,1/5/2024 7:32,CMM2,QC009,pass,PO000458,PART-019,LOT-00458,2024-01-04 03:32:00,439,M014,OP087,3,PLANT2,completed,True,-0.5714807675663809,False,False
M0000459,PART-020,LOT-00459,parallelism,0,0.1,0.0,-0.02,1/12/2024 6:21,CMM3,QC008,fail,PO000459,PART-020,LOT-00459,2024-01-12 00:21:00,149,M005,OP092,3,PLANT2,completed,False,-0.8802626081981435,False,False
M0000460,PART-005,LOT-00460,flatness,0,0.1,0.0,0.054,1/23/2024 1:30,CMM2,QC003,pass,PO000460,PART-005,LOT-00460,2024-01-21 10:30:00,326,M016,OP075,1,PLANT2,completed,True,-0.8779826385107807,False,False
M0000461,PART-045,LOT-00461,length,20,20.2,19.8,19.908,1/21/2024 1:53,CMM2,QC003,pass,PO000461,PART-045,LOT-00461,2024-01-20 00:53:00,298,M002,OP047,3,PLANT3,in_progress,True,-0.2662729334715655,False,False
M0000462,PART-035,LOT-00462,bore_diameter,50,50.4,49.6,49.773,1/28/2024 1:36,CMM1,QC006,pass,PO000462,PART-035,LOT-00462,2024-01-28 00:36:00,346,M003,OP014,3,PLANT1,completed,True,0.653879697786426,False,False
M0000463,PART-023,LOT-00463,flatness,0,0.1,0.0,-0.002,1/9/2024 17:41,CMM2,QC008,fail,PO000463,PART-023,LOT-00463,2024-01-08 13:41:00,351,M020,OP006,1,PLANT3,delayed,False,-0.8797080209768932,False,False
M0000464,PART-044,LOT-00464,outer_diameter,100,100.5,99.5,100.064,1/31/2024 21:24,CMM1,QC012,pass,PO000464,PART-044,LOT-00464,2024-01-30 10:24:00,224,M011,OP056,1,PLANT1,completed,True,2.2033655835589236,False,False
M0000465,PART-017,LOT-00465,parallelism,0,0.1,0.0,-0.001,1/12/2024 3:29,CMM1,QC003,fail,PO000465,PART-017,LOT-00465,2024-01-11 02:29:00,281,M017,OP072,3,PLANT3,completed,False,-0.8796772105757126,False,False
M0000466,PART-015,LOT-00466,bore_diameter,50,50.4,49.6,49.724,1/22/2024 16:54,CMM3,QC013,pass,PO000466,PART-015,LOT-00466,2024-01-21 06:54:00,211,M013,OP060,1,PLANT3,completed,True,0.6523699881285774,False,False
M0000467,PART-033,LOT-00467,angle,45,46.0,44.0,44.97,1/8/2024 2:39,CMM1,QC011,pass,PO000467,PART-033,LOT-00467,2024-01-07 20:39:00,196,M001,OP062,2,PLANT1,completed,True,0.5058973409161049,False,False
M0000468,PART-006,LOT-00468,width,10,10.1,9.9,9.957,1/7/2024 6:46,CMM2,QC001,pass,PO000468,PART-006,LOT-00468,2024-01-06 06:46:00,445,M005,OP045,1,PLANT2,completed,True,-0.572867235619507,False,False
M0000469,PART-014,LOT-00469,bore_diameter,50,50.4,49.6,50.089,1/25/2024 11:11,CMM3,QC013,pass,PO000469,PART-014,LOT-00469,2024-01-24 17:11:00,267,M012,OP061,2,PLANT1,completed,True,0.6636157845594888,False,False
M0000470,PART-045,LOT-00470,parallelism,0,0.1,0.0,0.012,1/23/2024 1:11,CMM2,QC019,pass,PO000470,PART-045,LOT-00470,2024-01-21 14:11:00,183,M003,OP039,2,PLANT1,in_progress,True,-0.879276675360365,False,False
M0000471,PART-008,LOT-00471,thickness,5,5.05,4.95,4.984,1/3/2024 9:40,CMM1,QC015,pass,PO000471,PART-008,LOT-00471,2024-01-02 00:40:00,454,M011,OP083,3,PLANT1,completed,True,-0.7260873606905263,False,False
M0000472,PART-011,LOT-00472,bore_diameter,50,50.4,49.6,49.931,1/12/2024 17:25,CMM2,QC004,pass,PO000472,PART-011,LOT-00472,2024-01-12 02:25:00,284,M006,OP071,3,PLANT1,completed,True,0.6587477411729573,False,False
M0000473,PART-028,LOT-00473,bore_diameter,50,50.4,49.6,49.859,1/23/2024 5:41,CMM2,QC001,pass,PO000473,PART-028,LOT-00473,2024-01-22 00:41:00,138,M013,OP081,3,PLANT1,completed,True,0.6565293922879557,False,False
M0000474,PART-043,LOT-00474,outer_diameter,100,100.5,99.5,99.99,1/22/2024 16:00,CMM1,QC016,pass,PO000474,PART-043,LOT-00474,2024-01-20 16:00:00,222,M001,OP095,2,PLANT3,in_progress,True,2.2010856138715607,False,False
M0000475,PART-029,LOT-00475,angle,45,46.0,44.0,45.318,1/28/2024 17:50,CMM3,QC007,pass,PO000475,PART-029,LOT-00475,2024-01-27 22:50:00,239,M013,OP001,3,PLANT3,completed,True,0.5166193605269465,False,False
M0000476,PART-018,LOT-00476,width,10,10.1,9.9,9.967,1/3/2024 22:20,CMM2,QC017,pass,PO000476,PART-018,LOT-00476,2024-01-03 20:20:00,315,M004,OP069,2,PLANT1,completed,True,-0.5725591316077012,False,False
M0000477,PART-013,LOT-00477,outer_diameter,100,100.5,99.5,100.084,1/21/2024 23:46,CMM2,QC004,pass,PO000477,PART-013,LOT-00477,2024-01-21 19:46:00,78,M009,OP086,2,PLANT2,completed,True,2.2039817915825353,False,False
M0000478,PART-041,LOT-00478,flatness,0,0.1,0.0,-0.018,1/15/2024 8:19,CMM2,QC020,fail,PO000478,PART-041,LOT-00478,2024-01-15 06:19:00,325,M013,OP079,1,PLANT2,completed,False,-0.8802009873957825,False,False
M0000479,PART-023,LOT-00479,bore_diameter,50,50.4,49.6,49.894,1/17/2024 5:27,CMM2,QC010,pass,PO000479,PART-023,LOT-00479,2024-01-17 00:27:00,452,M015,OP080,3,PLANT1,in_progress,True,0.6576077563292759,False,False
M0000480,PART-046,LOT-00480,thickness,5,5.05,4.95,4.998,1/15/2024 10:53,CMM2,QC019,pass,PO000480,PART-046,LOT-00480,2024-01-14 12:53:00,490,M020,OP076,1,PLANT1,completed,True,-0.7256560150739981,False,False
M0000481,PART-021,LOT-00481,flatness,0,0.1,0.0,-0.035,1/6/2024 22:44,CMM1,QC008,fail,PO000481,PART-021,LOT-00481,2024-01-06 08:44:00,142,M010,OP015,1,PLANT1,completed,False,-0.8807247642158522,False,False
